Title,Authors,Publisher,Published Date,TextSnippet,ISBN_13,PageCount,Categories,Language,ListPrice,RetailPrice,Title_clean,Current Price,Original Price,Rating
Be Useful,Arnold Schwarzenegger,Random House,2023-10-10,That these are the same person sounds like the setup to a joke. But this is no joke. This is Arnold Schwarzenegger. And this did not happen by accident. Arnold&#39;s stratospheric success happened as part of a process.,9781529916300,171,Biography & Autobiography,en,1215.4,607.7,be useful,,,
"Be Water, My Friend",Shannon Lee,Random House,2020-10-08,This is an inspirational call to action to consider our lives with new eyes and a testament to Lee&#39;s unique power to ignite our imaginations and transform our lives.,9781473583627,199,Sports & Recreation,en,618.61,309.3,"be water, my friend",₹219.00,₹599.00,1.0
Be Your Own Sunshine,"James Allen,",Sristhi Publishers & Distributors,2022-02-10,"<b>James Allen</b>,. Foreword T <b>his</b> little volume ( the result <b>of</b> meditation and experience ) is not intended as an exhaustive treatise on the much - written- upon subject <b>of</b> the power <b>of</b> thought . It is suggestive rather than explanatory , <b>its</b>&nbsp;...",9789387022850,114,Self-Help,en,153.4,107.38,be your own sunshine,₹175.00,,4.0
Beach Read,Emily Henry,Penguin UK,2020-05-18,". . I closed this book with a satisfied sigh&#39; Jasmine Guillory, While We Were Dating &#39;Clever and funny, this is a tender love story&#39; Woman &amp; Home",9780241989531,297,Fiction,en,353.11,247.18,beach read,₹249.00,₹399.00,2.0
"Beautiful Venom (Vipers, Band 1)",Rina Kent,dark Intense,2025-12-11,"Doch zu spät wird klar, hinter seiner Fassade schimmern die giftigen Schuppen eines Raubtiers. Der Auftakt der heißbegehrten Dark-Romance-Reihe von Rina Kent und der Start in ein neues Kapitel des Rinaverse!",9783732027095,528,Fiction,de,1099.0,549.5,"beautiful venom (vipers, band 1)",,,
"Beautiful World, Where Are You",Sally Rooney,Faber & Faber,2021-09-07,"&#39; Anne Enright, Guardian &#39;Rooney&#39;s best novel yet.&#39; Brandon Taylor, New York Times &#39;Get ready to have your heart broken all over again.&#39; Red &#39;The book moved me to tears more than once.",9780571365456,323,Fiction,en,478.0,334.6,"beautiful world, where are you",,,
Before the Coffee Gets Cold,Toshikazu Kawaguchi,Pan Macmillan,2019-09-19,"And finally, they must return to the present before the coffee gets cold . . . ‘This book broke my heart, took the pieces, and put them back together in a messy and beautiful way. . . &#39; - well.read.woman on Instagram Continue the ...",9781529029598,201,Fiction,en,560.78,280.39,before the coffee gets cold,,,
Before Your Memory Fades,Toshikazu Kawaguchi,Pan Macmillan,2022-09-01,The third book in the multi-million-copy bestselling series about a cosy Japanese cafe that offers its visitors the chance to travel back in time.,9781529089448,224,Fiction,en,560.78,280.39,before your memory fades,₹159.00,₹899.00,5.0
Behave,Robert M Sapolsky,Random House,2017-05-25,How have our brains evolved alongside our cultures? This is the exhilarating story of human morality and the science underpinning the biggest question of all: what makes us human? &#39;One of the best scientist-writers of our time&#39; Oliver Sacks,9781448129782,750,Psychology,en,530.11,265.06,behave,,,
Behind the Net,Stephanie Archer,Heyne Verlag,2024-08-01,Auf dem Eis ist er der Star.,9783641323271,384,Fiction,de,1273.2,636.6,behind the net,₹205.00,₹399.00,4.0
Believe In Yourself (Gujarati),Dr Joseph Murphy,Manjul Publishing,2022,"શું તમે તમારી યોગ્યતાઓ અને ક્ષમતાઓનો પૂર્ણપણે ઉપયોગ કરવા માગો છો? જો હા, તો તમારે આ પુસ્તક ...",9789355430250,86,Self-Help,gu,123.9,123.9,believe in yourself (gujarati),,,
Believe It to Achieve It,"Brian Tracy, Christina Stein",Penguin,2017-12-26,"Essential reading for anyone feeling stuck, BELIEVE IT TO ACHIEVE IT offers an important roadmap to conquer negativity and embrace the power of positive thinking to live a happy, successful life.",9781524704872,242,Self-Help,en,1057.17,528.58,believe it to achieve it,,,
Belladonna,Adalyn Grace,Hachette UK,2022-08-30,. . READERS LOVE ADALYN GRACE &#39;One of my new favourites. I absolutely loved everything about this book&#39; ⭐⭐⭐⭐⭐ &#39;I LOVED this. If you like gothic romance then this is for you&#39; ⭐⭐⭐⭐⭐ &#39;Could not stop reading!,9781529367249,383,Young Adult Fiction,en,920.4,460.2,belladonna,,,
Berserk Volume 11,Kentaro Miura,Dark Horse Comics,2017-07-18,"The Band of the Hawk — what&#39;s left of them — are on the run, Guts and Casca having rescued the Hawks&#39; leader, Griffith, from the horrors of the King of Midland&#39;s dungeons.",9781506704241,239,Comics & Graphic Novels,en,836.62,418.31,berserk volume 11,,,
Berserk Volume 2,Kentaro Miura,Dark Horse Comics,2017-07-18,"The evil Count uses his dark powers to transform a defeated guard captain into an inhuman horror to combat Guts, the Black Swordsman.",9781506704159,239,Comics & Graphic Novels,en,836.62,418.31,berserk volume 2,₹199.00,₹999.00,5.0
Berserk Volume 2,Kentaro Miura,Dark Horse Comics,2017-07-18,"The evil Count uses his dark powers to transform a defeated guard captain into an inhuman horror to combat Guts, the Black Swordsman.",9781506704159,239,Comics & Graphic Novels,en,836.62,418.31,berserk volume 2,₹199.00,₹999.00,5.0
Berserk Volume 3,Kentaro Miura,Dark Horse Comics,2017-07-18,"Guts, the feared Black Swordsman, finishes his desperate battle with the monstrous Count, cutting and blasting him to gory scraps when the presence of the Count&#39;s daughter makes the monster hesitate.",9781506704197,238,Comics & Graphic Novels,en,836.62,418.31,berserk volume 3,₹199.00,₹999.00,4.0
Better Hate than Never,Chloe Liese,Hachette UK,2023-10-10,"As desire gives way to deeper feelings, Kate and Christopher must decide if it&#39;s truly better to hate than to never risk their hearts - or if they already gave them away long ago. Why readers love Chloe Liese . . .",9780349436081,364,Fiction,en,554.6,277.3,better hate than never,,,
Better Than the Movies,Lynn Painter,Simon and Schuster,2024-03-28,"Pre-order Nothing Like the Movies, the swoony sequel to Better than the Movies and don&#39;t miss out on The Do-Over and Betting On You from Lynn Painter!",9781398536531,315,Young Adult Fiction,en,437.78,306.45,better than the movies,₹179.00,₹499.00,5.0
Beyond Entrepreneurship 2.0,Jim Collins,Random House,2020-12-01,"______________________________ THE BOOK THAT REED HASTINGS AT NETFLIX TOLD EVERY ASPIRING CEO TO READ Nearly thirty years ago, Stanford University faculty members Jim Collins and Bill Lazier showed you how to turn an entrepreneurial ...",9781473585737,306,Business & Economics,en,1149.61,574.8,beyond entrepreneurship 2.0,,,
Beyond Order,Jordan B. Peterson,Penguin UK,2021-03-02,Beyond Order therefore calls on us to balance the two fundamental principles of reality - order and chaos - and reveals the profound meaning that can be found on the path that divides them.,9780241407653,257,Self-Help,en,707.11,353.56,beyond order,,,
Beyond the Story,"BTS, Myeongseok Kang",Pan Macmillan,2023-07-09,"As digital artists, BTS has been communicating with the world through the internet and this book allows readers to immediately access trailers, music videos, and more online to have a rich understanding of all the key moments in BTS history ...",9781035031580,410,Biography & Autobiography,en,1348.57,674.28,beyond the story,,,
Big Little Lies,Liane Moriarty,Penguin UK,2014-07-31,"A tense, page-turning story . . . a great read&#39; Mail on Sunday &#39;Blending romance, comedy and mystery, this is a wonderful book - full of brains, guts and heart&#39; Sunday Mirror &#39;A hell of a good book.",9781405916370,466,Fiction,en,500.32,250.16,big little lies,₹199.00,₹499.00,3.0
Bihar Diaries/बिहार डायरीज़,अमित लोढ़ा,Penguin Random House India Private Limited,2021-01-21,बिहार डायरीज़ अमित लोढ़ा द्वारा एक भयावह गिरोह के सरगना सामंत प्रताप की रोमांचक गिरफ्तारी ...,9789391149031,256,Fiction,hi,179.36,125.55,bihar diaries/बिहार डायरीज़,,,
Black Holes: The Reith Lectures,Stephen Hawking,Random House,2016-05-05,Stephen Hawking. CLIFFHANGER In my previous <b>lecture</b> I left you on a cliffhanger.,9781473541986,82,Science,en,87.61,87.61,black holes: the reith lectures,₹105.00,₹199.00,3.0
"Black Flowers, White Lies",Yvonne Ventresca,Simon and Schuster,2016-10-04,"... <b>ties</b> . My delayed response verges on awkward . &quot; Okay , &quot; I say . &quot; What are you wearing it with ? &quot; &quot; A gray suit . &quot; I&#39;m conscious of his eyes on me as I study the ones he&#39;s chosen . It makes it hard to think . None of the <b>ties</b> have&nbsp;...",9781510709973,221,Young Adult Fiction,en,672.6,336.3,"black flowers, white lies",,,
Blood of Elves,Andrzej Sapkowski,Hachette UK,2010-08-19,"The Witcher, Geralt of Rivia, holds the fate of the world in his hands in the New York Times bestselling first novel in the Witcher series that inspired the Netflix show and video games.",9780575087491,362,Fiction,en,460.2,322.14,blood of elves,,,
Blue Exorcist 06,Kazue Kato,M&C!,2017-03-01,"Kecurigaan terhadap ayah Suguro, Tatsuma, semakin dalam karena suatu fakta yang terungkap dalam pertemuan petinggi sekte Myo Dha.",9786024282240,212,Comics & Graphic Novels,id,188.73,132.11,blue exorcist 06,,,
Blue Beetle Vol. 2: Forever Blue,Josh Trujillo,DC Comics,2025-01-14,"... WHERE IS &quot; HERE &quot; ? THE. ACTUALLY , I DON&#39;T CARE . HM . THANKS FOR THE TIP ABOUT THE AUTOGRAPHS ! SORRY TO BOTHER YOU ! YOU KNOW , WE REALLY OUGHTA PUT A <b>LOCK</b> ON THAT DOOR . HA BWA HAM HANN &quot; ... I&#39;M SURROUNDED BY IDIOTS . &quot; YOU SAW.",9781799504139,132,Comics & Graphic Novels,en,1379.37,689.68,blue beetle vol. 2: forever blue,,,
Blue Lock 5,Muneyuki Kaneshiro,Kodansha USA,2021-07-20,"In the face of Team V, Team Z has managed to catch up 3-3 with fifteen minutes remaining.",9781636992310,193,Comics & Graphic Novels,en,1167.02,583.51,blue lock 5,,,
Blue Lock 1,Muneyuki Kaneshiro,Kodansha USA,2021-03-16,"After a disastrous defeat at the 2018 World Cup, Japan&#39;s team struggles to regroup.",9781636990033,209,Comics & Graphic Novels,en,1167.02,583.51,blue lock 1,₹199.00,₹999.00,1.0
Blue Lock 30,Muneyuki Kaneshiro,Kodansha USA,2025-03-04,Germany has tied the score thanks to a devastating strike by Isagi&#39;s new weapon!,9798894784212,192,Comics & Graphic Novels,en,1167.02,583.51,blue lock 30,,,
Blue Ocean Shift,"Renee Mauborgne, W. Chan Kim",Pan Macmillan,2017-09-21,This book will empower you to succeed as you embark on your own blue ocean journey. Blue Ocean Shift is indispensable for anyone committed to building a compelling future.,9781509832200,302,Business & Economics,en,673.17,336.58,blue ocean shift,,,
Blue Ocean Shift,"Renee Mauborgne, W. Chan Kim",Pan Macmillan,2017-09-21,This book will empower you to succeed as you embark on your own blue ocean journey. Blue Ocean Shift is indispensable for anyone committed to building a compelling future.,9781509832200,302,Business & Economics,en,673.17,336.58,blue ocean shift,,,
Blue Sisters,Coco Mellors,BASTEI LÜBBE,2024-08-30,"Nach dem internationalen Bestseller CLEOPATRA UND FRANKENSTEIN legt Coco Mellors ihr zweites Buch vor, das ihrem Debüt an Warmherzigkeit, sprachlicher Brillanz und psychologischem Tiefgang in nichts nachsteht.",9783751764612,419,Fiction,de,2835.91,2835.91,blue sisters,,,
BODY LANGUAGE (Hindi),ARUN SAGAR 'ANAND',V&amp;S Publishers,2015-01-06,Body language communication ka ek mahatavpuran ang hai jise kabhi najarandaj nahi kiya ja sakta. Lekhak Arun Sagar Anand ne prastut pustak me shararik haw-bhaw sambandhit tathyo ke saath aavshyak chitron ka vistrit varanan kiya hai.,9789350573518,127,Psychology,en,303.06,212.14,body language (hindi),,,
Born A Crime,Trevor Noah,Hachette UK,2016-11-17,"Born a Crime is equally the story of that young man&#39;s fearless, rebellious and fervently religious mother - a woman determined to save her son from the cycle of poverty, violence and abuse that ultimately threatens her own life.",9781473635319,250,Biography & Autobiography,en,324.5,227.15,born a crime,,,
Boundaries = Freedom,Joseph Nguyen,Manjul Publishing,2024-07-27,"This book was written to help you learn how to create this space so that you will always have room for love and joy in your life, no matter what happens in it.",9789355436078,63,Self-Help,en,273.19,191.23,boundaries = freedom,,,
Boundaries,Instaread,Instaread Summaries,2015-10-06,PLEASE NOTE: This is key takeaways and analysis of the book and NOT the original book. Inside this Instaread of Boundaries:Overview of the bookImportant PeopleKey TakeawaysAnalysis of Key Takeaways,9781944195137,35,Psychology,en,549.0,275.0,boundaries,,,
Bravehearts of Bharat,Vikram Sampath,Penguin Random House India Private Limited,2022-10-26,"Fifteen Brave Men and Women of Bharat who Never Succumbed to the Challenges of Invaders But were Lost and Forgotten in the Annals of History. These are the stories of those Bravehearts who Fought to Protect their Rights, Faith and Freedom.",9789354928284,375,Political Science,en,718.62,359.31,bravehearts of bharat,₹199.00,₹799.00,1.0
Breaking Twitter,Ben Mezrich,Pan Macmillan,2023-11-09,"With unique access to Twitter insiders and Musk’s confidants, this is the astonishing story from all sides. Why did Elon overhaul Twitter’s blue-tick system, and how did it lead to the near-collapse of the company’s revenue?",9781035032495,324,Biography & Autobiography,en,560.78,280.39,breaking twitter,,,
Breathe! You Are Alive,Thich Nhat Hanh,Random House,2012-12-31,"In Breathe! You Are Alive, scholar, poet and Zen master Thich Nhat Hanh unfolds this core teaching, showing how to apply it to everyday life.",9781448175208,80,Philosophy,en,486.75,340.72,breathe! you are alive,,,
Bride,Ali Hazelwood,Hachette UK,2024-02-06,"&#39; Popsugar &#39;A beautifully written romantic comedy with a heroine you will instantly fall in love with.&#39; Elizabeth Everett, author of A Lady&#39;s Formula for Love *Ali Hazelwood&#39;s Bride was a Sunday Times bestseller w/e 10 February 2024.",9781408728871,385,Fiction,en,554.6,277.3,bride,,,
Brief Answers to the Big Questions,Stephen Hawking,Hachette UK,2018-10-16,"THE NO.1 SUNDAY TIMES BESTSELLER &#39;A beautiful little book by a brilliant mind&#39; DAILY TELEGRAPH &#39;Effortlessly instructive, absorbing, up to the minute and - where it matters - witty&#39; GUARDIAN The world-famous cosmologist and #1 bestselling ...",9781473696006,167,Biography & Autobiography,en,466.1,326.27,brief answers to the big questions,,,
Build the Life You Want,"Oprah Winfrey, Arthur C Brooks",Random House,2023-09-12,"And getting there will be the adventure of a lifetime. In Build the Life You Want, Harvard Professor Arthur C. Brooks and Oprah Winfrey invite you to begin a journey toward greater happiness, no matter how challenging your circumstances.",9781529919868,218,Self-Help,en,1698.02,1698.02,build the life you want,,,
Building a Second Brain,Tiago Forte,Profile Books,2022-06-14,"... <b>brain</b>. Third, sharing our ideas with others introduces a major element of serendipity. When you present an idea to <b>another</b> person, their reaction is inherently unpredictable. They will often be completely uninterested in an aspect you&nbsp;...",9781800812239,171,Business & Economics,en,1089.81,544.9,building a second brain,₹199.00,₹399.00,2.0
Building a StoryBrand 2.0,Donald Miller,HarperCollins Leadership,2025-01-07,"In Building a StoryBrand 2.0, Donald Miller not only deepens his teaching on how to use his seven universal story elements—he&#39;ll provide you with one of the most powerful and cutting-edge tools to help with your brand messaging efficacy ...",9781400248889,303,Business & Economics,en,1668.21,1668.21,building a storybrand 2.0,,,
Built to Move,"Juliet Starrett, Kelly Starrett",Hachette UK,2023-04-06,"The <b>10 essential habits</b> that will <b>help you</b> live a longer, healthier life Juliet Starrett, Kelly Starrett. BUILT THE <b>10 ESSENTIAL HABITS</b> TO <b>HELP YOU MOVE FREELY</b> AND <b>LIVE FULLY</b> TO KELLY STARRETT &amp; JULIET STARRETT <b>MOVE</b> For Georgia and&nbsp;...",9781398708709,380,Health & Fitness,en,1178.82,589.41,built to move,,,
Rival,Penelope Douglas,Hachette UK,2014-08-26,"&#39;RIVAL was as gripping as it was sexy&#39; COLLEEN HOOVER &#39;A gritty, racy new adult tale peppered with raw emotions . . . smoking-hot, action-packed&#39; Publishers Weekly &#39;Intensely emotional writing, angst-driven plot, and abundance of steamy sex ...",9780349405827,278,Fiction,en,500.32,250.16,rival,,,
The Butcher's Apprentice,Aliza Green,Quarry Books,2012-06-01,"Whether you&#39;re a casual cook or a devoted gourmand, you&#39;ll learn even more ways to buy, prepare, serve, and savor all types of artisan meat cuts with this skillful guide.",9781610583930,178,Cooking,en,2653.47,2653.47,the butcher's apprentice,,,
Butter,Asako Yuzuki,HarperCollins UK,2024-02-29,THE NUMBER ONE SUNDAY TIMES BESTSELLING SENSATION WINNER OF WATERSTONES BOOK OF THE YEAR 2024 WINNER OF THE BRITISH BOOK AWARDS DEBUT NOVEL OF THE YEAR 2025 SHORTLISTED FOR THE CWA CRIME FICTION IN TRANSLATION DAGGER AWARD 2025 A BBC ...,9780008511692,404,Fiction,en,1673.6,1673.6,butter,,,
By a Thread,Lucy Score,Hachette UK,2023-07-13,From Sunday Times and #1 New York Times bestselling author of Things We Never Got Over Dominic: I got her fired.,9781399726894,539,Fiction,en,637.2,318.6,,₹289.00,₹799.00,3.0
By the Sea,Abdulrazak Gurnah,Bloomsbury Publishing,2021-11-11,Staggering novel of displacement and loss from the critically acclaimed author,9781526653406,295,Fiction,en,399.0,279.3,,₹289.00,₹799.00,3.0
Call Me By Your Name,Andre Aciman,Atlantic Books Ltd,2011-03-01,For what the two discover on the Riviera and during a sultry evening in Rome is the one thing they both already fear they may never truly find again: total intimacy. Rediscover one of the great love stories of our time.,9780857895264,257,Fiction,en,838.95,419.48,call me,₹175.00,₹499.00,5.0
Capital,Karl Marx,Penguin UK,2004-02-05,"Living in exile in England, where this work was largely written, Marx drew on a wide-ranging knowledge of its society to support his analysis.",9780141920603,1037,Political Science,en,884.11,442.06,capital,,,
Finale,Stephanie Garber,Hachette UK,2019-05-09,. . &#39;Unbelievably good&#39; ⭐⭐⭐⭐⭐ &#39;Amazing and magical in every aspect&#39; ⭐⭐⭐⭐⭐ &#39;This book series will forever hold a place in my heart and I really don&#39;t know how to move on from this&#39; ⭐⭐⭐⭐⭐,9781473666801,364,Fiction,en,649.0,324.5,finale,,,
Careless People,Sarah Wynn-Williams,Pan Macmillan,2025-03-13,"With a new foreword for paperback from Naomi Alderman. ‘Amazing: of all the books in all the world Mr Free Speech Zuckerberg wants to ban, it’s the one about him’ – Marina Hyde ‘Urgently necessary reading’ – Elizabeth Day, ...",9781035065943,378,Biography & Autobiography,en,560.78,280.39,careless people,,,
Cashflow Quadrant (Telugu),Robert Kiyosaki,Manjul Publishing,2021-09-25,జనం ఆర్ధిక భదత్రను ఎందుకు కోరుకుంటారు? మూడు రకాల వ్యాపార వ్యవస్థలేమిటి? పెట్టుబడి ...,9789390924912,304,Business & Economics,te,330.4,231.28,cashflow quadrant (telugu),,,
Catch-22 by Joseph Heller (Book Analysis),Bright Summaries,BrightSummaries.com,2019-04-03,"This satirical novel about the deep psychological scars left by the trauma of war was heavily inspired by Heller’s own experiences as a soldier during the Second World War, and is generally considered his masterpiece.",9782808016636,20,Study Aids,en,1055.71,527.86,catch-22,₹199.00,₹299.00,2.0
Caught Up,Navessa Allen,Hachette UK,2025-06-10,the brand new sizzling dark romance from the author of TikTok sensation Lights Out <b>Navessa Allen</b>. Also by <b>Navessa Allen</b> Lights Out AN INTO DARKNESS NOVEL CAUGHT <b>UP NAVESSA ALLEN</b> Q QUERCUS.,9781529442441,385,Fiction,en,560.5,280.25,caught up,,,
"Change by Design, Revised and Updated",Tim Brown,HarperCollins,2019-03-05,"The subject of “design thinking” is the rage at business schools, throughout corporations, and increasingly in the popular press—due in large part to the work of IDEO, a leading design firm, and its celebrated CEO, Tim Brown, who uses ...",9780062856715,296,Psychology,en,808.01,404.0,change,₹299.00,₹999.00,3.0
Use Your Brain to Change Your Age,Daniel G. Amen,Hachette UK,2012-05-17,"In Use Your Brain to Change Your Age, clinical neuroscientist and bestselling author Dr Daniel G. Amen shares simple steps to boost your brain, helping you to look, feel and think younger.",9781405516020,229,Health & Fitness,en,450.76,315.53,use your brain to change your age,,,
Chip War,Chris Miller,Simon and Schuster,2022-10-04,"Currently, as Chip War reveals, China, which spends more on chips than any other product, is pouring billions into a chip-building Manhattan Project to catch up to the US. In Chip War economic historian Chris Miller recounts the fascinating ...",9781398504110,342,Business & Economics,en,613.6,306.8,chip war,₹205.00,"₹1,999.00",4.0
Cinema Speculation,Quentin Tarantino,Hachette UK,2022-11-01,"Organized around key American films from the 1970s, all of which he first saw as a young moviegoer at the time, this book is as intellectually rigorous and insightful as it is rollicking and entertaining.",9781474624251,317,Performing Arts,en,649.0,324.5,cinema speculation,,,
City of Djinns,William Dalrymple,Penguin,2003-03-25,"Entertaining, fascinating, and informative, City of Djinns is an irresistible blend of research and adventure.",9781101127018,353,Travel,en,1057.17,528.58,city of djinns,₹249.00,₹599.00,2.0
Clarity & Connection,yung pueblo,Andrews McMeel Publishing,2021-04-27,"Never before offered in hardcover, the three volumes trace Yung Pueblo’s own journey toward self-awareness.",9781524869861,243,Poetry,en,977.69,488.84,clarity & connection,₹199.00,₹999.00,2.0
Classroom of the Elite (Light Novel) Vol. 1,Syougo Kinugasa,Seven Seas Entertainment,2019-02-07,"&#39;&quot;Students of the prestigious Tokyo Metropolitan Advanced Nurturing High School are given remarkable freedom--if they can win, barter, or save enough points to work their way up the ranks!",9781645051541,312,Young Adult Fiction,en,1049.0,549.0,classroom of the elite (light novel) vol. 1,,,
A Study Guide for Anita Desai's Clear Light of Day,"Gale, Cengage Learning","Gale, Cengage Learning ",2015-09-15,"A Study Guide for Anita Desai&#39;s &quot;Clear Light of Day,&quot; excerpted from Gale&#39;s acclaimed Novels for Students.This concise study guide includes plot summary; character analysis; author biography; study questions; historical context; suggestions ...",9781410335623,36,Literary Criticism,en,423.8,296.66,a study guide for anita desai's clear light of day,,,
Closer to Love,Vex King,Pan Macmillan,2023-02-13,"Vex King, author of bestselling Good Vibes, Good Life and Healing is the New High is back with Closer, a practical guide to creating lasting connections.",9781529087864,279,Self-Help,en,560.78,280.39,closer to love,₹189.00,₹599.00,4.0
When We Collided: A Story of First Love and Finding Yourself,Adrian Ferruelo,Adrian Ferruelo,2025-04-29,"Perfect for fans of The Fault in Our Stars and To All the Boys I’ve Loved Before, this novel will make you laugh, cry, and believe in the power of first love.",9798311674898,287,Fiction,en,319.0,225.0,when we collided: a story of first love and finding yourself,,,
34 Years Chapterwise Solutions NEET Biology 2022,Arihant Experts,Arihant Publications India limited,2021-04-10,1. 34 Years’ Chapterwise Solution NEET Biology” is a collect of all questions of AIPMT &amp; NEET 2. The book covers the entire syllabus of in 40 chapters 3.,9789325795471,385,Study Aids,en,344.56,241.19,34 years chapterwise solutions neet biology 2022,,,
Common Stocks and Uncommon Profits and Other Writings,Philip A. Fisher,John Wiley & Sons,2015-04-03,... <b>unusual</b> high-quality <b>stocks</b> simply because each has had such a sharp fast rise that its price-<b>earnings</b> ratio suddenly looks high in relation to that to which the investment community had become accustomed. In view of the importance of&nbsp;...,9781119143123,320,Business & Economics,en,708.0,354.0,common stocks and uncommon profits and other writings,"₹1,499.00","₹2,999.00",2.0
Summary and Analysis of Contagious: Why Things Catch On,Worth Books,Open Road Media,2017-03-21,This short summary and analysis of Contagious includes: Historical context Chapter-by-chapter overviews Detailed timeline of key events Important quotes Fascinating trivia Glossary of terms Supporting material to enhance your understanding ...,9781504044738,35,Study Aids,en,139.24,139.24,summary and analysis of contagious: why things catch on,,,
Continuous Discovery Habits,Teresa Torres,Product Talk LLC,2021-05-19,"&quot;If you haven&#39;t had the good fortune to be coached by a strong leader or product coach, this book can help fill that gap and set you on the path to success.",9781736633311,209,Design,en,1049.0,549.0,continuous discovery habits,₹349.00,"₹1,999.00",2.0
