Title,Authors,Publisher,Published Date,TextSnippet,ISBN_13,PageCount,Categories,Language,ListPrice,RetailPrice,Title_clean,Current Price,Original Price,Rating
Alexander the Great,Martin Howard,Bloomsbury Publishing,2012-05-24,"Alexander the Great, one of the most courageous and heroic figures of the ancient world, played a key part in historical events which catapulted him to world fame.",9781408163702,129,Juvenile Nonfiction,en,583.0,291.5,alexander the great,₹95.00,₹150.00,5.0
Autobiography of a Yogi,"Paramahansa Yogananda, Sheba Blake",Sheba Blake Publishing,2022-01-10,"The famous opera singer Amelita Galli-Curci said about the book: &quot;Amazing, true stories of saints and masters of India, blended with priceless superphysical information-much needed to balance the Western material efficiency with Eastern ...",9783986770105,645,Biography & Autobiography,en,319.0,223.3,autobiography of a yogi,₹159.00,₹199.00,2.0
Be Your Own Sunshine,"James Allen,",Sristhi Publishers & Distributors,2022-02-10,"... <b>own</b> pace, as per <b>our</b> comfort? What happens when we are buried under the fear <b>of</b> being left behind? These ... <b>James Allen</b> pioneers in the field <b>of</b> motivational literature, as he has mastered the art <b>of</b> amalgamating philosophy&nbsp;...",9789387022850,114,Self-Help,en,153.4,107.38,be your own sunshine,₹175.00,,4.0
Black Holes: The Reith Lectures,Stephen Hawking,Random House,2016-05-05,Stephen Hawking. CLIFFHANGER In my previous <b>lecture</b> I left you on a cliffhanger.,9781473541986,82,Science,en,87.61,87.61,black holes: the reith lectures,₹105.00,₹199.00,3.0
Deep and Silent Waters,Charlotte Lamb,Hachette UK,2013-03-28,"... <b>silence</b> all evening in a little bar along the Rio San Barnaba , one of the many canals bisecting the Dorsoduro , the ... <b>water</b> below their perfect bow shape . &#39; What&#39;s it mean ? &#39; asked Carmen , the junior assistant director , her&nbsp;...",9781444770322,353,Fiction,en,350.46,245.32,deep and silent waters,₹169.00,₹599.00,3.0
How to Become Rich,JayaPrakash,Notion Press,2018-08-10,"Getting rich is not an easy task until you read this book. After this book, you will be a financial role model for others. This book not only talks about the financials of getting rich but also teaches you the way of life.",9781643248615,52,Business & Economics,en,70.8,70.8,how to become rich,,,
How to Win Friends and Influence People,Instaread,Instaread,2016-07-19,"Inside this Instaread Summary of How to Win Friends and Influence People: · Overview of the Book · Important People · Key Takeaways · Analysis of Key Takeaways About the Author With Instaread, you can get the key takeaways, summary and ...",9781683784104,27,Self-Help,en,549.0,275.0,how to win friends and influence people,₹95.00,₹250.00,4.0
कफन (Hindi Sahitya),"प्रेमचन्द, Premchand",Bhartiya Sahitya Inc.,2011-12-30,"Kafan story by Premchand हिंदी कथा-साहित्य की सबसे सशक्त और अविस्मरणीय कहानियों में से एक, &#39;कफन&#39;, के साथ ...",9781613010006,155,Fiction,hi,749.0,375.0,कफन (hindi sahitya),,,
Letters from a Father to His Daughter,Jawaharlal Nehru,Penguin Random House India Private Limited,2022-11-07,"This book is a memoir of Dr C. Rangarajan, an Indian economist, a former Member of Parliament, and the 19th Governor of the Reserve Bank of India.",9789354925214,117,Biography & Autobiography,en,315.06,220.54,letters from a father to his daughter,₹165.00,₹299.00,4.0
Manto Kahani Samagra,Saadat Hasan Manto,SHARDA PRAKASHAN,2020-10-15,This Book has all the stories written by Saadat Hasan Manto.,9788194711131,1983,Antiques & Collectibles,hi,295.0,206.5,manto kahani samagra,,,
The Saffron Wave,Thomas Blom Hansen,Princeton University Press,1999-03-23,"In The Saffron Wave, Thomas Hansen turns our attention to recent events in the world&#39;s largest democracy, India.",9781400823055,300,Religion,en,4218.5,4218.5,the saffron wave,,,
प्रतिज्ञा (Hindi Sahitya),"प्रेमचन्द, Premchand",Bhartiya Sahitya Inc.,2012-02-24,प्रेमचंद ने हिन्दी कहानी को एक निश्चित परिप्रेक्ष्य व कलात्मक आधार दिया। उन्होंने कहानी ...,9781613011119,206,Fiction,hi,749.0,375.0,प्रतिज्ञा (hindi sahitya),,,
Reminders of You,Calliope Casimiro,Archway Publishing,2024-03-19,"The Universe has an ornery sense of humor, and we are all just her playthings to keep her entertained.",9781665757287,663,Fiction,en,392.94,275.06,reminders of you,,,
Babylon ka Sabse Ameer Aadmi,George S Clason,Manjul Publishing,2005-06,बैबिलॉन का सबसे अमीर आदमी आर्थिक सफलता के शाश्वत रहस्य धन-दौलत पर लिखी सबसे प्रेरक पुस्तक ...,9788183220194,182,Self-Help,hi,145.0,145.0,babylon ka sabse ameer aadmi,,,
The Art of War,Sun Tzu,Shambhala Publications,2002-09-17,"Compiled more than two thousand years ago by a mysterious warrior-philosopher, The Art of War is still perhaps the most prestigious and influential book of strategy in the world, as eagerly studied in Asia by modern politicians and ...",9780834821705,243,History,en,643.1,321.55,the art of war,₹149.00,₹299.00,3.0
The Autobiography of Benjamin Franklin,Benjamin Franklin,Arcturus Publishing,2019-01-31,"&quot; In this fascinating account of the life of one of America&#39;s greatest statesmen, The Autobiography of Benjamin Franklin describes this Founding Father&#39;s rise from his humble beginnings in Philadelphia to his role at the centre of ...",9781789506419,255,Biography & Autobiography,en,100.0,100.0,the autobiography of benjamin franklin,₹99.00,₹150.00,3.0
The Belated Bachelor Party,Ravinder Singh,Harper Collins,2019-05-27,"Welcome to one hell of a reunion!Bestselling author Ravinder Singh returns with his friends in a hilarious, moving story of friendship and adventure.",9789353570736,231,Fiction,en,159.0,111.3,the belated bachelor party,₹140.00,₹199.00,2.0
The Casual Vacancy,J.K. Rowling,Hachette UK,2012-09-27,"Who will triumph in an election fraught with passion, duplicity and unexpected revelations? A big novel about a small town, THE CASUAL VACANCY is J.K. Rowling&#39;s first novel for adults. It is the work of a storyteller like no other.",9781405519229,609,Fiction,en,271.4,189.98,the casual vacancy,₹210.00,₹599.00,5.0
The Diary of a Young Girl (Hindi),Anne Frank,Manjul Publishing,2016-12-02,विश्व की सर्वाधिक बिकने वाली पुस्तकों में से एक यह उस युवती का मर्मस्पर्शी दस्तावेज़ है जो ...,9788183227797,311,Biography & Autobiography,hi,153.4,107.38,the diary of a young girl (hindi),,,
The Killer Book of Infamous Murders,"Tom Philbin, Michael Philbin","Sourcebooks, Inc.",2011-03-01,The Killer Book of Infamous Murders takes you behind the crime scene tape and into the heart of notorious and remorseless massacres.,9781402269189,266,True Crime,en,916.15,458.08,the killer book of infamous murders,,,
The Richest Man in Babylon,George S. Clason,Courier Corporation,2022-05-25,"Read by millions, this classic offers today&#39;s readers a path to success, prosperity, and happiness. Easy to read stories packed with wisdom use parables set 6,000 years ago in ancient Babylon.",9780486850931,144,Self-Help,en,489.3,342.51,the richest man in babylon,₹95.00,₹175.00,5.0
The Science of Getting Rich,Wallace D. Wattles,St. Martin's Essentials,2020-08-18,"Author Wallace D. Wattles was a formative writer of the New Thought tradition. This new edition of his timeless book includes Wattle’s original text along with two bonus books, The Science of Being Great and The Science of Being Well.",9781250624895,219,Self-Help,en,849.4,424.7,the science of getting rich,,,
The World How I See It, Aadi Sai Vijaykaran,Blue Hill Publications,2021-09-01,"... <b>World&#39;s</b> Top Debater under 15 ... the first - ever from India . As I walkedup to the podium to <b>get</b> my hands on the gold cup , a rush of thoughts flurried through my head . &quot; How did I win <b>it</b> ? &quot; My journey was ... <b>WORLD HOW I SEE IT</b> 111.",9789390788439,134,Literary Collections,en,99.0,99.0,the world how i see it,,,
Think and grow rich in Hinglish,Napoleon Hill,Notion Press,2024-12-14,"If you’ve ever felt held back by language barriers, this Hinglish edition is your key to understanding and applying Napoleon Hill’s timeless principles.",9798896327271,289,Self-Help,en,349.0,244.3,think and grow rich in hinglish,,,
Three Men in a Boat : Om Illustrated Classics,"Jerome K Jerome, Om Books International",Om Books International,2018-08,"Hidden within the seemingly funny incidents and comments are the writer’s opinions on the foibles in England’s history and society. The book offers a refreshing look at the various places, people and mannerisms in the country.",9789384225452,239,Juvenile Fiction,en,46.02,46.02,three men in a boat : om illustrated classics,,,
Treasure Island,Robert Louis Stevenson,Bantam Classics,2004-03-30,"Perhaps the greatest of all adventure stories for boys and girls, Treasure Island began, a brave boy who finds himself among pirates, and of the sinister pirate-cook Long John Silver holds children as entranced today as it did a century ago ...",9780553898590,221,Juvenile Fiction,en,150.11,105.08,treasure island,₹99.00,₹150.00,2.0
You Can Heal Your Life,Louise Hay,"Hay House, Inc",1995-03-07,"I love this book . . . and I love Louise Hay.” — Dr. Wayne W. Dyer, author of The Power of Intention You Can Heal Your Life has transformed the lives of millions of people.",9781401922641,274,Self-Help,en,900.34,450.17,you can heal your life,,,
$100M LOST CHAPTERS,Alex Hormozi,"Acquisition.com, LLC",2025-09-10,"Who This Is For: ● You&#39;ve read the $100M books and want to go deeper ● You&#39;re making money but know you&#39;re leaving cash on the table ● You like understanding WHY things work, not just copying tactics ● You want the plays that were  ...",9781963349559,260,Business & Economics,en,1599.0,1599.0,$100m lost chapters,,,
10% Happier,Dan Harris,Hachette UK,2014-06-19,"This is a book that will help people&#39; ELIZABETH GILBERT, author of Eat, Pray, Love After having a nationally televised panic attack, news anchor DAN HARRIS knew he had to make some changes.",9781444799064,229,"Body, Mind & Spirit",en,350.46,245.32,10% happier,,,
100 to 1 in the Stock Market,Thomas William Phelps,Echo Point+ORM,2021-08-01,"In this indispensable guide, Phelps analyzes what made the big companies of his day so profitable for the diligent, long-term investor.",9781648374661,425,Business & Economics,en,1092.68,546.34,100 to 1 in the stock market,₹549.00,"₹4,999.00",4.0
100 Ways to Improve Your Writing (Updated),Gary Provost,Penguin,2019-05-28,"This is the one guide that anyone who writes—whether student, businessperson, or professional writer—should keep on his or her desk.",9781984805614,178,Language Arts & Disciplines,en,679.66,339.83,100 ways to improve your writing (updated),,,
12 Months to $1 Million,Ryan Daniel Moran,BenBella Books,2020-05-05,"This is the road map to a seven-figure business . . . in one year or less The word &quot;entrepreneur&quot; is today&#39;s favorite buzzword, and any aspiring business owner has likely encountered an overwhelming number of so-called &quot;easy paths to ...",9781950665143,206,Business & Economics,en,1008.9,504.45,12 months to $1 million,,,
12 Rules for Life,Jordan B. Peterson,Penguin UK,2018-01-16,"In this book, he provides twelve profound and practical principles for how to live a meaningful life, from setting your house in order before criticising others to comparing yourself to who you were yesterday, not someone else today.",9780241351659,536,Self-Help,en,565.46,282.73,12 rules for life,,,
13 Reasons Why NOT to Kill Yourself,Lisa Hanson,Rise UP Publications,2022-05-10,"A Note <b>For</b> Suicide Prevention Lisa Hanson. By payment <b>of</b> required fees , <b>you</b> have been granted <b>the</b> non - exclusive ... <b>cause</b> whatsoever whether such claim or <b>cause</b> arises in contract , tort , or otherwise . In short , <b>you</b> , <b>the</b>&nbsp;...",9781644572870,74,Young Adult Nonfiction,en,358.4,250.88,13 reasons why not to kill yourself,,,
1Q84: Books 1 and 2,Haruki Murakami,Random House,2011-10-18,Read this imaginative masterpiece from the internationally bestselling author of Norwegian Wood The year is 1984.,9781446484197,628,Fiction,en,530.11,265.06,1q84: books 1 and 2,,,
7 Days of Effective Communication Skills: Unlocking the Power of Oral and Written Communication,Zenab,Rana Books Uk ,2023-09-19,"With valuable tips for grooming and business English phrases, this book empowers readers to become confident and impactful communicators in both personal and professional settings, making it a must-read resource for anyone seeking to unlock ...",9788119786312,61,Business & Economics,en,129.0,129.0,7 days of effective communication skills: unlocking the power of oral and written communication,,,
21 Lessons for the 21st Century,Yuval Noah Harari,Random House,2018-08-30,"**THE NUMBER ONE BESTSELLER** In twenty-one bite-sized lessons, Yuval Noah Harari explores what it means to be human in an age of bewilderment.",9781473554719,256,History,en,565.46,282.73,21 lessons for the 21st century,₹179.00,₹599.00,5.0
400 Days,Chetan Bhagat,Harper Collins,2022-07-01,From India&#39;s highest-selling author comes a page-turner that will not only keep you glued to the story but also touch you deeply.,9789356291379,333,Fiction,en,200.0,140.0,400 days,₹149.00,₹250.00,4.0
Startup Weekend,"Marc Nager, Clint Nelsen, Franck Nouyrigat",John Wiley & Sons,2011-10-07,"Startup Weekend, the book, contains best practices, lessons learned, and empowering examples derived from the organization&#39;s experiences for individuals and small organizations to follow as they launch businesses.",9781118159637,208,Business & Economics,en,2666.8,2666.8,startup weekend,,,
501 Portuguese Verbs,"John J. Nitti, Michael J. Ferreira",Simon and Schuster,2015-11-23,"Each verb is listed alphabetically in easy-to-follow chart form—one verb per page with its English translation. This comprehensive guide to is ideal for students, travelers, and adult learners.",9781438067933,1166,Foreign Language Study,en,739.86,369.93,501 portuguese verbs,"₹1,049.00","₹1,199.00",2.0
Ati Prabhavkari Logon ki 7 Aadatein,Dr Stephen R Covey,Manjul Publishing,2017-01-25,"... <b>Hindi</b> translation of The 7 <b>Habits of Highly Effective People</b> by Stephen R. Covey This <b>edition</b> first published in 2005 Twenty - ninth impression 2024 Copyright © 1989 , 2004 FranklinCovey Company Franklin Covey and the FC logo and&nbsp;...",9788186775998,589,Self-Help,hi,520.38,260.19,ati prabhavkari logon ki 7 aadatein,,,
"7 Mindsets for Success, Happiness and Fulfilment (Hindi)",Swami Mukundananda,Manjul Publishing,2020-12-28,लंबे समय तक चलने वाले विचार और भावनाएँ परिपक्वहोकर नज़रिये में बदल जाते हैं। अगर आप लंबे समय ...,9789390085675,210,Self-Help,hi,206.5,144.55,"7 mindsets for success, happiness and fulfilment (hindi)",,,
7 Secrets to Investing Like Warren Buffett,"Mary Buffett, Sean Seah",Simon and Schuster,2019-10-22,"... <b>Secrets to Investing Like Warren Buffett</b> to explain <b>Warren Buffett&#39;s</b> techniques and philosophy to new <b>investors</b> . The two of us are different in many ways . Sean was born , educated , and lives in Singapore , and has the perspective of&nbsp;...",9781471188985,144,Business & Economics,en,702.1,351.05,7 secrets to investing like warren buffett,₹165.00,₹399.00,2.0
Summary: 80/20 Sales and Marketing,"BusinessNews Publishing,",Primento,2014-10-28,The must-read summary of Perry Marshall’s book: “80/20 Sales and Marketing: The Definitive Guide to Working Less and Making More”.,9782511023945,28,Business & Economics,en,1055.71,527.86,summary: 80/20 sales and marketing,,,
80/20 Your Life | More Achievement with Less Work: The Art of Changing Lives,Damon Zahariades,Prabhat Prakashan,2024-09-30,"80/20 नियम, जिसे &#39;पैरेटो सिद्धांत&#39; के रूप में भी जाना जाता है, एक इतालवी अर्थशास्त्री विल्फ्रेडो ...",9789355627278,313,Self-Help,hi,325.68,227.98,80/20 your life | more achievement with less work: the art of changing lives,,,
99% Mine,Sally Thorne,Hachette UK,2019-01-29,"She&#39;s going to make Tom Valeska ninety-nine percent hers. ____________ Find out why everyone is obsessed with Sally Thorne &#39;The perfect sexy, fun love story to read by the pool&#39; PAIGE TOON on 99% Mine &#39;Charming, self-deprecating, quick ...",9780349422879,211,Fiction,en,743.4,371.7,99% mine,,,
A Really Short History of Nearly Everything,Bill Bryson,Penguin UK,2020-10-29,The extraordinary Bill Bryson takes us from the Big Bang to the dawn of science in this book about basically everything.,9780241451953,184,Young Adult Nonfiction,en,1543.44,1543.44,a really short history of nearly everything,,,
A Brief History of the Philosophy of Time,Adrian Bardon,Oxford University Press,2013-06-03,"Adrian Bardon&#39;s A Brief History of the Philosophy of Time is a short introduction to the history, philosophy, and science of the study of time-from the pre-Socratic philosophers through Einstein and beyond.",9780199977734,198,Philosophy,en,518.24,259.12,a brief history of the philosophy of time,,,
A Christmas Date,Camilla Isley,Pink Bloom Press,2018-10-25,"A Festive Holidays Romantic Comedy <b>Camilla Isley</b>. About. the. Author. Camilla is an engineer turned writer after she quit her job to follow her husband on an adventure abroad. She&#39;s a cat lover, coffee addict, and shoe hoarder. Besides&nbsp;...",9788887269284,207,Fiction,en,449.99,314.99,a christmas date,,,
The Trader's Book of Volume: The Definitive Guide to Volume Trading,Mark Leibovit,McGraw Hill Professional,2011-01-07,Learn how to translate the &quot;language&quot; of volume!,9780071753760,464,Business & Economics,en,6498.27,6498.27,the trader's book of volume: the definitive guide to volume trading,,,
A Court of Thorns and Roses eBook Bundle,Sarah J. Maas,Bloomsbury Publishing,2022-05-05,"A <b>5 Book</b> Bundle Sarah J. Maas. CHAPTER. 38. Amren took the <b>Book</b> to wherever it was she lived in Velaris , leaving <b>the</b> ... <b>set</b> . Of course of course - Rhysand was already lounging in one of the white - painted iron chairs , an arm&nbsp;...",9781526654441,3181,Fiction,en,4788.0,4788.0,a court of thorns and roses ebook bundle,,,
A Curse for True Love,Stephanie Garber,Hachette UK,2023-10-24,. . &#39;I wanna live in this book.,9781529399301,456,Fiction,en,560.5,280.25,a curse for true love,,,
A Promise of Peridot,Kate Golden,Hachette UK,2024-04-11,"&#39;If I could give more stars, I absolutely would . . . fast paced, angsty, raw, and funny&#39; ⭐⭐⭐⭐⭐ &#39;This has been my favourite series I&#39;ve ever read right next to ACOTAR&#39; ⭐⭐⭐⭐⭐ &#39;The characters come to life in a way that is ...",9781529434071,454,Fiction,en,1178.82,589.41,a promise of peridot,,,
A Day of Fallen Night,Samantha Shannon,Bloomsbury Publishing,2023-02-28,"**THE NUMBER ONE BESTSELLER** &#39;A magnificent, sweeping epic&#39; JENNIFER SAINT, Sunday Times-bestselling author of ARIADNE &#39;Shannon is simply a master of the genre&#39; C. S. PACAT, New York Times-bestselling author of DARK RISE &#39;A tremendous ...",9781526663351,881,Fiction,en,479.0,335.3,a day of fallen night,₹645.00,₹899.00,5.0
Here Lie All the Boys Who Broke My Heart,Emma Simmerman,Simon and Schuster,2026-02-03,"This book was one heck of a ride’ ‘The perfect blend of mystery and suspense, with a hint of romance’ ‘I don&#39;t think I have ever read a book so fast in my entire life’ ‘Had everything from messy characters, quick banter, mystery ...",9781398550896,323,Fiction,en,263.14,184.2,here lie all the boys who broke my heart,,,
A Gentleman in Moscow,Amor Towles,Random House,2017-01-09,"OVER 4 MILLION COPIES SOLD A Showtime/Paramount+ series starring Ewan McGregor as Count Alexander Rostov From the number one New York Times-bestselling author, a beautifully transporting novel about a man who is ordered to spend the rest of ...",9781448135509,547,Fiction,en,441.61,309.13,a gentleman in moscow,,,
A House Without Windows,Nadia Hashimi,HarperCollins,2016-08-16,"A vivid, unforgettable work of women’s fiction and the story of an unlikely sisterhood—an emotionally powerful and haunting tale of friendship that illuminates the plight of women in a traditional culture—from the author of the ...",9780062449665,336,Fiction,en,559.67,279.84,a house without windows,,,
A Kingdom of Flesh and Fire,Jennifer L. Armentrout,Blue Box Press,2020-09-01,From #1 New York Times bestselling author Jennifer L. Armentrout comes a new novel in her Blood and Ash series… Is Love Stronger Than Vengeance?,9781952457104,703,Fiction,en,954.67,954.67,a kingdom of flesh and fire,₹449.00,₹999.00,1.0
A Short History of the World,H. G. Wells,"Cosimo, Inc.",2005-12-01,"Wells asks that you read this hefty 1922 work-adapted from his two-volume Outline of History, published in 1920-&quot;straightforwardly almost as a novel is read,&quot; and indeed, this story of Earth, from its very formation and the first appearance ...",9781596055858,477,History,en,549.0,275.0,a short history of the world,,,
A Little Life,Instaread,Instaread,2016-01-25,A Little Life by Hanya Yanagihara | Summary &amp; Analysis Preview: A Little Life by Hanya Yanagihara tells the story of Jude St. Francis and the people in his life.,9781944195670,23,Fiction,en,549.0,275.0,a little life,₹299.00,₹799.00,2.0
A Love Letter To Whiskey,Kandi Steiner,VAJONA Verlag,2024-01-11,"<b>Kandi Steiner</b>. Jamies Abschlussfeier am Strand losgelassen hatte, waren wieder aufgetaucht, und jetzt waren sie hier, überwogen in meinem Kopf und warteten darauf, dass ich sie ansprach. Ich wünschte mir sehnlichst eine Badewanne, denn&nbsp;...",9783757991524,408,Fiction,de,759.33,379.66,a love letter to whiskey,,,
A Manual of Hindu Astrology (Correct Casting of Horoscopes), B. V. Raman,Motilal Banarsidass Publishing House,2025-09-22,"... <b>The</b> other part of our mind is waiting to emerge from within . It waits for <b>the</b> right time to emerge , and if it doesn&#39;t find <b>the</b> right opportunity , it is bound to come up in <b>your dreams</b> . <b>The</b> mind always works both ways dialectically . If&nbsp;...",9789359661452,545,"Body, Mind & Spirit",en,354.0,247.8,a manual of hindu astrology (correct casting of horoscopes),,,
A Million Kisses In Your Lifetime,Monica Murphy,Random House,2022-08-11,DISCOVER THE DEEPLY ROMANTIC AND UNFORGETTABLE TIKTOK SENSATION THAT WILL GRIP YOU UNTIL THE VERY LAST PAGE &#39;Wren and Crew stole my heart and neither of them will give it back. I cannot explain how much I adore this story . . .,9781405955577,402,Fiction,en,384.68,269.28,a million kisses in your lifetime,₹205.00,₹699.00,5.0
A Death in Kasol,Gunjesh Bond,Leadstart Publishing Pvt Ltd,1901,All Arpana wanted was to escape the chaos of Delhi!,9789355590183,253,Fiction,en,177.0,123.9,a death in kasol,,,
A New Earth,Eckhart Tolle,Penguin UK,2009-01-01,A New Earth is waiting for you. _________ &#39;Life-changing&#39; Caroline Hirons &#39;I&#39;m gonna have to listen to [this podcast] several times! Too good!&#39; Fearne Cotton on the &#39;Oprah and Eckhart Tolle: A New Earth&#39; podcast &#39;This book changed my life.,9780141908762,240,"Body, Mind & Spirit",en,349.57,244.7,a new earth,,,
A Passage to India,E M Forster,Hachette UK,2011-06-09,"Forster&#39;s classic novel, with a new introduction by Kamila Shamsie, author of Home Fire, winner of the Women&#39;s Prize for Fiction &#39;There&#39;s no writer better than Forster at portraying the genuine feelings that are born from the interaction ...",9781444728811,455,Fiction,en,997.1,498.55,a passage to india,,,
A Perfect Day to be Alone,Nanae Aoyama,Hachette UK,2024-05-09,"I hope we have more translations from this author ASAP, she is super talented! As is the translator!&quot; ***** &quot;A Perfect Day to Be Alone by Nanae Aoyama blew me away utterly and completely&quot; ***** Translated from the Japanese by Jesse Kirkwood",9781529427691,126,Fiction,en,466.1,326.27,a perfect day to be alone,,,
A Poem for Every Spring Day,Allie Esiri,Pan Macmillan,2021-02-04,"Perfect for reading aloud and sharing with all the family, this book dazzles with an array of familiar favourites and remarkable new discoveries.",9781529063479,355,Juvenile Nonfiction,en,560.78,280.39,a poem for every spring day,,,
A Psalm for the Wild-Built,Becky Chambers,Tordotcom,2021-07-13,"Winner of the Hugo Award! In A Psalm for the Wild-Built, bestselling Becky Chambers&#39;s delightful new Monk and Robot series, gives us hope for the future.",9781250236227,104,Fiction,en,1326.29,663.14,a psalm for the wild-built,,,
