Title,Authors,Publisher,Published Date,TextSnippet,ISBN_13,PageCount,Categories,Language,ListPrice,RetailPrice,Title_clean,Current Price,Original Price,Rating
The Perfect Divorce,Jeneva Rose,Hachette UK,2025-04-15,"What everyone is saying about The Perfect Divorce: &#39;Even better than The Perfect Marriage!&#39; Reader Review, ⭐️⭐️⭐️⭐️⭐️ &#39;This book was so ridiculously good!... I thought it was even better than the first.",9781398723641,278,Fiction,en,554.6,277.3,the perfect divorce,,,
The Perfect Divorce,Jeneva Rose,Blackstone Publishing,2025-04-15,"Filled with page-turning suspense and Jeneva Rose’s signature twists and turns, this book will have readers wondering, Can Bob and Sarah achieve the perfect divorce? Or will it be “till death do us part”?",9798874620950,327,Fiction,en,1060.85,530.42,the perfect divorce,,,
The Good Son,Carolyn Huizinga Mills,Cormorant Books,2021-03-20,"Zoe Emmerson has a secret, one she’s kept for years.",9781770865938,221,Fiction,en,1399.0,699.0,the good son,,,
The Reappearance of Rachel Price (deutsche Ausgabe),Holly Jackson,BASTEI LÜBBE,2024-08-20,Vor 16 Jahren verschwand Bels Mutter Rachel auf mysteriöse Weise.,9783751761659,524,Young Adult Fiction,de,1167.41,583.7,the reappearance of rachel price (deutsche ausgabe),,,
The Secret History,Donna Tartt,Hachette UK,2013-05-02,"A &#39;haunting, compelling, and brilliant&#39;(The Times) novel about a group of students who, under the influence of their professor find their lives changed forever, by the Pulitzer Prize-winning author of The Goldfinch Truly deserving of the ...",9781405529631,545,Fiction,en,400.02,280.01,the secret history,,,
The Silent Patient,Alex Michaelides,Hachette UK,2019-02-05,"The <b>record-breaking</b>, <b>multimillion copy Sunday Times bestselling thriller</b> and TikTok sensation Alex Michaelides. Praise for The <b>Silent Patient</b> &#39; That rarest of beasts : the perfect <b>thriller</b> . This extraordinary novel set my blood fizzing&nbsp;...",9781409181644,286,Fiction,en,371.7,260.19,the silent patient,,,
The Spy and the Traitor,Ben Macintyre,Penguin UK,2018-09-20,"His best book yet&#39; John Preston, Evening Standard &#39;A remarkable story of one man&#39;s courage&#39; The Times, Book of the Week BEN MACINTYRE&#39;S NEXT BOOK, REDWOOD, IS AVAILABLE FOR PRE-ORDER NOW Ben Macintyre, Sunday Times bestseller, August 2023",9780241186671,304,Political Science,en,530.11,265.06,the spy and the traitor,,,
The Maddest Obsession,Danielle Lori,BASTEI LÜBBE,2024-10-18,"... mit der Handlung von The <b>Sweetest Oblivion</b>. Solltet ihr The <b>Sweetest Oblivion</b> noch nicht gelesen haben, es jedoch vorhaben, empfehle ich, es zuerst zu lesen. Eure Danielle xo TEIL 1 Die Vergangenheit Anmerkung der Autorin.",9783736318946,409,Fiction,de,1370.63,685.32,the maddest obsession,₹249.00,"₹1,499.00",2.0
The Takeover Diaries,Rock Svensson,AuthorHouse,2017-12-29,Rock provides a background to the growth of this fictional company and the truth behind the takeover battle that inspired this novel.,9781546217701,388,Fiction,en,323.32,226.32,the takeover diaries,,,
The Tenants,M A Hunter,Boldwood Books Ltd,2025-08-18,"Readers are loving The Tenants 💘 &#39;Atmospheric, unsettling and full of twists, this book masterfully blends a claustrophobic setting with characters who all feel suspicious in their own way.&#39; ⭐️⭐️⭐️⭐️⭐️ Reader Review  ...",9781835617434,337,Fiction,en,289.1,202.37,the tenants,,,
The Thursday Murder Club,Richard Osman,Penguin UK,2020-09-03,"THE FIRST NOVEL IN THE RECORD-BREAKING, MILLION-COPY BESTSELLING THURSDAY MURDER CLUB SERIES.",9780241988275,356,Fiction,en,471.06,329.74,the thursday murder club,₹199.00,₹699.00,4.0
The Vegetarian,Han Kang,Portobello Books,2015-01-01,"Fraught, disturbing and beautiful, The Vegetarian is a novel about modern day South Korea, but also a novel about shame, desire and our faltering attempts to understand others, from one imprisoned body to another.",9781846275630,134,Fiction,en,1237.0,618.5,the vegetarian,,,
Summary: The Woman In The Window,Storify Library,XinXii,2023-09-26,SUMMARY: THE WOMAN IN THE WINDOW – BASED ON THE BOOK BY A. J. FINN Are you ready to boost your knowledge about &quot;THE WOMAN IN THE WINDOW&quot;? Do you want to quickly and concisely learn the key lessons of this book?,9781312069268,57,Self-Help,en,449.0,315.0,summary: the woman in the window,,,
Summary: Then She Was Gone - Based On The Book By Lisa Jewell,Storify Library,XinXii,2023-09-26,SUMMARY: THEN SHE WAS GONE – BASED ON THE BOOK BY LISA JEWELL Are you ready to boost your knowledge about &quot;THEN SHE WAS GONE&quot;? Do you want to quickly and concisely learn the key lessons of this book?,9781312069169,57,Self-Help,en,449.0,315.0,summary: then she was gone,,,
King of Kings,Lamont B. Jones,Xlibris Corporation,2013-03-20,"This book is dedicated to God whom I am a prisoner of so, as we are all in a good way. There&#39;s teaching and revelation along with future past present experiences nonfiction. The book will give you meaning &amp; adventure without tales.",9781483602592,199,Poetry,en,323.32,226.32,king of kings,,,
Traitors Gate (William Warwick Novels),Jeffrey Archer,HarperCollins UK,2023-09-26,24 hours to stop the crime of the century The race against time is about to begin...,9780008474393,329,Fiction,en,544.37,272.18,traitors gate (william warwick novels),,,
Vow of Deception,Angela Johnson,Kensington Publishing Corp.,2010-09-22,. . Praise for Angela Johnson&#39;s Vow of Seduction &quot;Outstanding!&quot; --Susan Johnson &quot;Johnson is one to watch.&quot; --Romantic Times,9781420122817,397,Fiction,en,603.76,301.88,vow of deception,₹285.00,"₹1,399.00",2.0
Watch Me – Ein Shatter-Me-Roman,Tahereh Mafi,cbj Verlag,2025-04-16,Tödlich präzise und gerissen ist Rosabelle ihre perfekte Waffe. Der Weltbestseller der dystopischen Fantasy geht endlich weiter! Das Spin-off zur Shatter-Me-Reihe von Tahereh Mafi,9783641331764,343,Young Adult Fiction,de,2016.42,2016.42,watch me – ein shatter-me-roman,,,
We Solve Murders,Richard Osman,Random House,2024-09-12,Steve Wheeler is enjoying retired life.,9780241608388,360,Fiction,en,771.72,385.86,we solve murders,,,
Who Killed Moosewala? The Spiralling Story of Violence in Punjab (English),Jupinderjit Singh,Westland Non-Fiction,2023,"... <b>killed</b> , ( https://www.hindustantimes.com/cities/chandigarh-news/3- women - farm - protesters - from - punjab - <b>killed</b> - as - truck - hits - them - in - bahadurgarh - 101635396705294.html ) 4. <b>Moosewala&#39;s</b> film Moosa Jatt is based on the&nbsp;...",9789357764612,146,True Crime,en,350.0,245.0,who killed moosewala? the spiralling story of violence in punjab (english),,,
"Wrong Place, Wrong Time",John A. Rich,JHU Press,2009-12-01,"... <b>moment</b> . Roy went on , hitting his stride now . “ Just like athletes are a community , church people are a community , dudes who play the girls are a community . But some of us don&#39;t belong no- where , and the streets are the last <b>place</b>&nbsp;...",9780801896231,234,Medical,en,2648.97,2648.97,"wrong place, wrong time",,,
The Yellow Face,Arthur Conan Doyle,SAMPI Books,2024-12-07,"Holmes investigates, but the case takes an unexpected turn, revealing a heartwarming story of love, acceptance, and a hidden past. This tale challenges prejudices and showcases Doyle&#39;s ability to weave human emotion into mystery.",9786561334440,41,Fiction,en,39.0,39.0,the yellow face,,,
13 Reasons Why NOT to Kill Yourself,Lisa Hanson,Rise UP Publications,2022-05-10,"A Note <b>For</b> Suicide Prevention Lisa Hanson. By payment <b>of</b> required fees , <b>you</b> have been granted <b>the</b> non - exclusive ... <b>cause</b> whatsoever whether such claim or <b>cause</b> arises in contract , tort , or otherwise . In short , <b>you</b> , <b>the</b>&nbsp;...",9781644572870,74,Young Adult Nonfiction,en,358.4,250.88,13 reasons why not to kill yourself,,,
1Q84: Books 1 and 2,Haruki Murakami,Random House,2011-10-18,Read this imaginative masterpiece from the internationally bestselling author of Norwegian Wood The year is 1984.,9781446484197,628,Fiction,en,530.11,265.06,1q84: books 1 and 2,,,
400 Days,Chetan Bhagat,Harper Collins,2022-07-01,From India&#39;s highest-selling author comes a page-turner that will not only keep you glued to the story but also touch you deeply.,9789356291379,333,Fiction,en,200.0,140.0,400 days,₹149.00,₹250.00,4.0
99% Mine,Sally Thorne,Hachette UK,2019-01-29,"She&#39;s going to make Tom Valeska ninety-nine percent hers. ____________ Find out why everyone is obsessed with Sally Thorne &#39;The perfect sexy, fun love story to read by the pool&#39; PAIGE TOON on 99% Mine &#39;Charming, self-deprecating, quick ...",9780349422879,211,Fiction,en,743.4,371.7,99% mine,,,
A Christmas Date,Camilla Isley,Pink Bloom Press,2018-10-25,"A Festive Holidays Romantic Comedy <b>Camilla Isley</b>. About. the. Author. Camilla is an engineer turned writer after she quit her job to follow her husband on an adventure abroad. She&#39;s a cat lover, coffee addict, and shoe hoarder. Besides&nbsp;...",9788887269284,207,Fiction,en,449.99,314.99,a christmas date,,,
A Court of Thorns and Roses eBook Bundle,Sarah J. Maas,Bloomsbury Publishing,2022-05-05,"A <b>5 Book</b> Bundle Sarah J. Maas. CHAPTER. 38. Amren took the <b>Book</b> to wherever it was she lived in Velaris , leaving <b>the</b> ... <b>set</b> . Of course of course - Rhysand was already lounging in one of the white - painted iron chairs , an arm&nbsp;...",9781526654441,3181,Fiction,en,4788.0,4788.0,a court of thorns and roses ebook bundle,,,
A Curse for True Love,Stephanie Garber,Hachette UK,2023-10-24,. . &#39;I wanna live in this book.,9781529399301,456,Fiction,en,560.5,280.25,a curse for true love,,,
A Promise of Peridot,Kate Golden,Hachette UK,2024-04-11,"&#39;If I could give more stars, I absolutely would . . . fast paced, angsty, raw, and funny&#39; ⭐⭐⭐⭐⭐ &#39;This has been my favourite series I&#39;ve ever read right next to ACOTAR&#39; ⭐⭐⭐⭐⭐ &#39;The characters come to life in a way that is ...",9781529434071,454,Fiction,en,1178.82,589.41,a promise of peridot,,,
A Day of Fallen Night,Samantha Shannon,Bloomsbury Publishing,2023-02-28,"**THE NUMBER ONE BESTSELLER** &#39;A magnificent, sweeping epic&#39; JENNIFER SAINT, Sunday Times-bestselling author of ARIADNE &#39;Shannon is simply a master of the genre&#39; C. S. PACAT, New York Times-bestselling author of DARK RISE &#39;A tremendous ...",9781526663351,881,Fiction,en,479.0,335.3,a day of fallen night,₹645.00,₹899.00,5.0
Here Lie All the Boys Who Broke My Heart,Emma Simmerman,Simon and Schuster,2026-02-03,"This book was one heck of a ride’ ‘The perfect blend of mystery and suspense, with a hint of romance’ ‘I don&#39;t think I have ever read a book so fast in my entire life’ ‘Had everything from messy characters, quick banter, mystery ...",9781398550896,323,Fiction,en,263.14,184.2,here lie all the boys who broke my heart,,,
A Gentleman in Moscow,Amor Towles,Random House,2017-01-09,"OVER 4 MILLION COPIES SOLD A Showtime/Paramount+ series starring Ewan McGregor as Count Alexander Rostov From the number one New York Times-bestselling author, a beautifully transporting novel about a man who is ordered to spend the rest of ...",9781448135509,547,Fiction,en,441.61,309.13,a gentleman in moscow,,,
A House Without Windows,Nadia Hashimi,HarperCollins,2016-08-16,"A vivid, unforgettable work of women’s fiction and the story of an unlikely sisterhood—an emotionally powerful and haunting tale of friendship that illuminates the plight of women in a traditional culture—from the author of the ...",9780062449665,336,Fiction,en,559.67,279.84,a house without windows,,,
A Kingdom of Flesh and Fire,Jennifer L. Armentrout,Blue Box Press,2020-09-01,From #1 New York Times bestselling author Jennifer L. Armentrout comes a new novel in her Blood and Ash series… Is Love Stronger Than Vengeance?,9781952457104,703,Fiction,en,954.67,954.67,a kingdom of flesh and fire,₹449.00,₹999.00,1.0
A Little Life,Instaread,Instaread,2016-01-25,A Little Life by Hanya Yanagihara | Summary &amp; Analysis Preview: A Little Life by Hanya Yanagihara tells the story of Jude St. Francis and the people in his life.,9781944195670,23,Fiction,en,549.0,275.0,a little life,₹299.00,₹799.00,2.0
A Love Letter To Whiskey,Kandi Steiner,VAJONA Verlag,2024-01-11,"<b>Kandi Steiner</b>. Jamies Abschlussfeier am Strand losgelassen hatte, waren wieder aufgetaucht, und jetzt waren sie hier, überwogen in meinem Kopf und warteten darauf, dass ich sie ansprach. Ich wünschte mir sehnlichst eine Badewanne, denn&nbsp;...",9783757991524,408,Fiction,de,759.33,379.66,a love letter to whiskey,,,
A Million Kisses In Your Lifetime,Monica Murphy,Random House,2022-08-11,DISCOVER THE DEEPLY ROMANTIC AND UNFORGETTABLE TIKTOK SENSATION THAT WILL GRIP YOU UNTIL THE VERY LAST PAGE &#39;Wren and Crew stole my heart and neither of them will give it back. I cannot explain how much I adore this story . . .,9781405955577,402,Fiction,en,384.68,269.28,a million kisses in your lifetime,₹205.00,₹699.00,5.0
A Passage to India,E M Forster,Hachette UK,2011-06-09,"Forster&#39;s classic novel, with a new introduction by Kamila Shamsie, author of Home Fire, winner of the Women&#39;s Prize for Fiction &#39;There&#39;s no writer better than Forster at portraying the genuine feelings that are born from the interaction ...",9781444728811,455,Fiction,en,997.1,498.55,a passage to india,,,
A Perfect Day to be Alone,Nanae Aoyama,Hachette UK,2024-05-09,"I hope we have more translations from this author ASAP, she is super talented! As is the translator!&quot; ***** &quot;A Perfect Day to Be Alone by Nanae Aoyama blew me away utterly and completely&quot; ***** Translated from the Japanese by Jesse Kirkwood",9781529427691,126,Fiction,en,466.1,326.27,a perfect day to be alone,,,
A Poem for Every Spring Day,Allie Esiri,Pan Macmillan,2021-02-04,"Perfect for reading aloud and sharing with all the family, this book dazzles with an array of familiar favourites and remarkable new discoveries.",9781529063479,355,Juvenile Nonfiction,en,560.78,280.39,a poem for every spring day,,,
A Psalm for the Wild-Built,Becky Chambers,Tordotcom,2021-07-13,"Winner of the Hugo Award! In A Psalm for the Wild-Built, bestselling Becky Chambers&#39;s delightful new Monk and Robot series, gives us hope for the future.",9781250236227,104,Fiction,en,1326.29,663.14,a psalm for the wild-built,,,
Forever on the Bay,Lee Tobin McClain,HQN Books,2022-04-26,The Off Season Book 1: Cottage at the Beach Book 2: Reunion at the Shore Book 3: Christmas on the Coast Book 4: Home to the Harbor Book 5: First Kiss at Christmas Book 6: Forever on the Bay Book 7: Second Chance on the Chesapeake Book 8: ...,9780369703682,306,Fiction,en,501.18,250.59,forever on the bay,,,
A Slow Fire Burning,Paula Hawkins,Random House,2021-08-31,"The new SCORCHING bestseller from bestselling author of THE GIRL ON THE TRAIN and INTO THE WATER &#39;Here are characters who are real and likeable, even when they are complicated and flawed.",9781473542228,280,Fiction,en,618.61,309.3,a slow fire burning,₹249.00,₹499.00,5.0
A Soul of Ash and Blood,Jennifer L. Armentrout,Blue Box Press,2023-07-18,"But this time, Hawke gets to tell the tale.",9781957568461,412,Fiction,en,954.67,954.67,a soul of ash and blood,,,
A Thousand Boy Kisses,Tillie Cole,Random House,2022-07-14,"DISCOVER THE UNFORGETTABLE TIKTOK SENSATION THAT HAS CAPTURED MILLIONS OF HEARTS &#39;This book is breathtakingly, heartbreakingly beautiful.",9781405955324,340,Fiction,en,771.72,385.86,a thousand boy kisses,₹205.00,₹499.00,2.0
A Thousand Broken Pieces,Tillie Cole,Random House,2024-07-18,"<b>Tillie Cole</b>. disappeared from view , leaving small chunks of the plate that couldn&#39;t be restored . I put the <b>broken pieces</b> in the correct place , but the plate was broken . It was that simple . &quot; Pick the plate up as a whole , &quot; Aika&nbsp;...",9781405962971,370,Fiction,en,771.72,385.86,a thousand broken pieces,,,
The Ethan Frost Series 3-Book Bundle,Tracy Wolff,Loveswept,2015-12-08,"Because my nightmares are darker, and my wounds deeper, than I could ever reveal. And as much as Ethan wants to protect me, the secrets we share will only tear us apart. The Ethan Frost series is intended for mature audiences.",9781101968512,806,Fiction,en,1057.17,528.58,the ethan frost series 3-book bundle,,,
You're Addicted to You,Noah Blumenthal,Berrett-Koehler Publishers,2007-04-16,"The fact of the matter is, willpower alone won&#39;t get you to change. Noah Blumenthal illustrates how each of us becomes so thoroughly conditioned to act in old, counterproductive ways that negative behaviors become part of our very being.",9781609944124,170,Self-Help,en,914.5,457.25,you're addicted to you,,,
Adelaide,Genevieve Wheeler,Bloomsbury Publishing,2024-05-30,Named Most Anticipated by: Bustle · Popsugar · Goodreads · Zibby Magazine · SheReads · Book Riot And featured in Cosmopolitan and Marie Claire *Nominated for the 2023 Goodreads Best Debut Novel award and longlisted for the Book of the ...,9781035912728,400,Fiction,en,280.0,196.0,adelaide,,,
After the Funeral (Poirot),Agatha Christie,HarperCollins UK,2010-10-14,The master of a Victorian mansion dies suddenly – and his sister is convinced it was murder....,9780007422128,299,Fiction,en,228.55,159.98,after the funeral (poirot),,,
Afterlives,Abdulrazak Gurnah,Bloomsbury Publishing,2020-09-17,"From &#39;one of Africa&#39;s greatest living writers&#39; (Giles Foden), a shatteringly powerful novel about a forgotten piece of Africa colonial history",9781526615879,289,Fiction,en,399.0,279.3,afterlives,₹199.00,₹699.00,1.0
Alchemy of Secrets,Stephanie Garber,Hachette UK,2025-10-07,"Alchemy of Secrets is the spectacular new novel from global phenomenon Stephanie Garber, the multimillion-copy bestselling author of the Caraval and Once Upon a Broken Heart series.",9781399631358,301,Fiction,en,649.0,324.5,alchemy of secrets,,,
All the Bright Places,Jennifer Niven,Penguin UK,2015-01-08,"&#39;If you&#39;re looking for the next The Fault in Our Stars, this is it&#39; Guardian &#39;This book is amazing - I couldn&#39;t put it down&#39; Zoe Sugg aka Zoella &#39;A searingly honest and heartbreakingly poignant tale about the power and beauty of love&#39; Heat  ...",9780141357041,325,Young Adult Fiction,en,353.11,247.18,all the bright places,₹399.00,₹450.00,2.0
All the truths,Rina Kent,Hope Edizioni,2024-12-15,<b>Rina Kent</b> Sara Marrano. AIL THE <b>TRUTHS</b> Hope Edizioni ROMANCE <b>RINA KENT</b> AIL THE <b>TRUTHS</b> TRADUZIONE di Roberta ZUPPET <b>RINA KENT</b>. Front Cover.,9788855318150,295,Fiction,it,638.49,319.24,all the truths,,,
All This Love,Ashish Bagrecha,Harper Collins,2025-12-05,"For anyone who&#39;s ever loved too hard, felt too much, or needed words when their own wouldn&#39;t come A raw, honest companion for heartbreak, healing and finding your way back to yourself From the author whose words reach millions - now a ...",9789373079608,265,Poetry,en,319.0,223.3,all this love,,,
All You Need Is Kill Novel,"Hiroshi Sakurazaka, Yoshitoshi ABe",TOKYOPOP Verlag,2017-11-16,Die Mimics greifen die Erde an und Schlachtfelder ziehen sich wie ein Flickenteppich über die Welt.,9783842043336,256,Comics & Graphic Novels,de,799.0,399.5,all you need is kill novel,,,
All Your Perfects / Finding Perfect Bind-up,Colleen Hoover,Simon and Schuster,2026-01-01,‘The reigning queen of BookTok’ GUARDIAN ‘One of the most influential voices of the last decade’ ELLE ‘One of the world&#39;s most successful writers’ DAILY MAIL A special bind-up edition from #1 Sunday Times bestselling author ...,9781398548220,391,Fiction,en,702.1,351.05,all your perfects / finding perfect bind-up,,,
Almond,Won-pyung Sohn,HarperCollins,2020-05-05,"This story is, in short, about a monster meeting another monster. One of the monsters is me. Yunjae was born with a brain condition called Alexithymia that makes it hard for him to feel emotions like fear or anger.",9780062961402,235,Fiction,en,808.01,404.0,almond,,,
"Always, in December",Emily Stone,Hachette UK,2021-08-05,"... Stone. * It started with a letter . It ended with a love story . Always , in * Derember &#39; Sweepingly romantic &#39; X &#39; Will wrap around you like a hug &#39; Josie Silver Holly Miller * <b>Emily Stone</b> Always , in <b>December Emily Stone</b> H REVIEW. Front&nbsp;...",9781472279613,350,Fiction,en,554.6,277.3,"always, in december",,,
Anatomy: A Love Story,Dana Schwartz,Hachette UK,2022-01-18,"I grinned, I gasped, I cried and ended this book breathless and craving more&#39; Alwyn Hamilton, New York Times bestselling author of the Rebel of the Sands series &#39;Diabolically delightful.",9780349433349,257,Young Adult Fiction,en,920.4,460.2,anatomy: a love story,,,
And Every Morning the Way Home Gets Longer and Longer,Fredrik Backman,Random House,2022-10-27,"... <b>Fredrik Backman</b>. where you were . &quot; She kisses him . &quot; I know that the <b>way home</b> is <b>getting longer</b> and <b>longer every morning</b> . But I loved you because your brain , your world , was always <b>bigger</b> than <b>everyone</b> else&#39;s . There&#39;s still a lot&nbsp;...",9781405930277,46,Fiction,en,771.72,385.86,and every morning the way home gets longer and longer,,,
Aristotle and Dante Discover the Secrets of the Universe,Benjamin Alire Sáenz,Simon and Schuster,2021-05-06,"... <b>Dante Discover Secrets Universe</b> XXXX D &#39; A GORGEOUS LOVE STORY AND A FOREVER FAVOURITE &#39; Adam Silvera , author of THEY BOTH DIE AT THE END THE INTERNATIONAL BESTSELLER FROM MULTI - AWARD - WINNING BENJAMIN ALIRE SÁENZ Praise for&nbsp;...",9781398505254,293,Juvenile Fiction,en,526.28,263.14,aristotle and dante discover the secrets of the universe,₹249.00,₹599.00,3.0
As Good as Dead (Angel Delaney Mysteries Book #3),Patricia H. Rushford,Baker Books,2005-09-01,... <b>three</b> small bedrooms coming off the hallway . ” Callen chuckled . “ Your brothers are mourning the loss of their ... <b>good</b> as mine . ” “ Hmm . Pretty soon I&#39;ll be able to lie on my bed and watch the waves . Have I thanked you yet&nbsp;...,9781441239464,256,Fiction,en,181.72,127.2,as good as dead (angel delaney mysteries book #3),,,
As Long As the Lemon Trees Grow,Zoulfa Katouh,Bloomsbury Publishing,2022-09-15,"Burning with the fires of hope and possibility, AS LONG AS THE LEMON TREES GROW will sweep you up and never let you go. _______________ SHORTLISTED FOR THE BRITISH BOOK AWARDS DISCOVER BOOK OF THE YEAR &#39;This is an important book.",9781526648495,467,Young Adult Fiction,en,440.0,308.0,as long as the lemon trees grow,,,
Ashwathama,Himanshu Verma,Notion Press,2023-10-13,"Ashwathama came and promised Duryodhana, that he will take back Hastinapur Kaliyug- Every Kaithi villager was watching same news, on TV and Mobile on Purali for last one day. The news was devastating, nothing left in the village.",9798891334496,123,Fiction,en,111.0,111.0,ashwathama,,,
Attack on Titan: The Anime Guide,Hajime Isayama,Kodansha America LLC,2021-03-16,"... <b>Titan</b> anime. Featuring ... The back stories of fan - favorite characters like Levi , as well as Annie and Mikasa : ATTACK ON <b>TITAN</b> NO REGRETS ATTACK ON <b>TITAN</b> LOST GIRLS • Attack on <b>Titan</b> : No Regrets ( <b>Vol</b> . <b>1</b>-2 ) • Attack on <b>Titan</b> : Lost&nbsp;...",9781636990293,180,Comics & Graphic Novels,en,1167.02,583.51,attack on titan: the anime guide,,,
Attack on Titan Guidebook: INSIDE & OUTSIDE,Hajime Isayama,Kodansha Comics,2014-09-16,"... <b>TITAN</b> ? A mysterious <b>Titan</b> appeared . A battle between <b>Titans</b> broke out ( Episode 7 , <b>Volume 2</b> ) . The mysterious <b>Titan</b> made use of combat techniques to crush one <b>Titan</b> after the next ( Episode 8 , <b>Volume 2</b> ) . The mysterious <b>Titan</b> cleared&nbsp;...",9781612629469,346,Comics & Graphic Novels,en,2653.47,2653.47,attack on titan guidebook: inside & outside,,,
Azadi,Arundhati Roy,Rajkamal Prakashan,2020-12-01,"आज़ादी—कश्मीर में आज़ादी के संघर्ष का नारा है, जिससे कश्मीरी उस चीज़ की मुख़ालफ़त करते हैं ...",9789389598704,191,Political Science,hi,299.0,209.3,azadi,,,
Babel: Or the Necessity of Violence: An Arcane History of the Oxford Translators’ Revolution,R.F. Kuang,HarperCollins UK,2022-09-01,"THE #2 SUNDAY TIMES AND #1 NYT BESTSELLER ‘One for Philip Pullman fans’ THE TIMES ‘This one is an automatic buy’ GLAMOUR ‘Ambitious, sweeping and epic’ EVENING STANDARD ‘Razor-sharp’ DAILY MAIL ‘An ingenious fantasy about ...",9780008501839,688,Fiction,en,1673.6,1673.6,babel: or the necessity of violence: an arcane history of the oxford translators’ revolution,,,
Beach Read,Emily Henry,Penguin UK,2020-05-18,". . I closed this book with a satisfied sigh&#39; Jasmine Guillory, While We Were Dating &#39;Clever and funny, this is a tender love story&#39; Woman &amp; Home",9780241989531,297,Fiction,en,353.11,247.18,beach read,₹249.00,₹399.00,2.0
"Beautiful Venom (Vipers, Band 1)",Rina Kent,dark Intense,2025-12-11,"Doch zu spät wird klar, hinter seiner Fassade schimmern die giftigen Schuppen eines Raubtiers. Der Auftakt der heißbegehrten Dark-Romance-Reihe von Rina Kent und der Start in ein neues Kapitel des Rinaverse!",9783732027095,528,Fiction,de,1099.0,549.5,"beautiful venom (vipers, band 1)",,,
