Title,Authors,Publisher,Published Date,TextSnippet,ISBN_13,PageCount,Categories,Language,ListPrice,RetailPrice,Title_clean,Current Price,Original Price,Rating
Summary and Analysis of Contagious: Why Things Catch On,Worth Books,Open Road Media,2017-03-21,This short summary and analysis of Contagious includes: Historical context Chapter-by-chapter overviews Detailed timeline of key events Important quotes Fascinating trivia Glossary of terms Supporting material to enhance your understanding ...,9781504044738,35,Study Aids,en,139.24,139.24,summary and analysis of contagious: why things catch on,,,
Continuous Discovery Habits,Teresa Torres,Product Talk LLC,2021-05-19,"&quot;If you haven&#39;t had the good fortune to be coached by a strong leader or product coach, this book can help fill that gap and set you on the path to success.",9781736633311,209,Design,en,1049.0,549.0,continuous discovery habits,₹349.00,"₹1,999.00",2.0
Million Dollar Copywriting Secrets,Noah Daniels,BookRix,2014-07-28,On the Internet copy is still king.,9783736827233,73,Self-Help,en,271.49,190.04,million dollar copywriting secrets,,,
Starry Messenger: Cosmic Perspectives on Civilisation,Neil deGrasse Tyson,HarperCollins,2022-09-29,"Bringing his cosmic perspective to civilization on Earth, Neil deGrasse Tyson, bestselling author of Astrophysics for People in a Hurry, shines new light on the crucial fault lines of our time–war, politics, religion, truth, beauty, ...",9780008543198,277,Science,en,1897.65,1897.65,starry messenger: cosmic perspectives on civilisation,,,
"Crucial Conversations Tools for Talking When Stakes Are High, Second Edition","Kerry Patterson, Joseph Grenny, Ron McMillan, Al Switzler",McGraw Hill Professional,2011-09-16,". This book deserves to take its place as one of the key thought leadership contributions of our time.” —from the Foreword by Stephen R. Covey, author of The 7 Habits of Highly Effective People “The quality of your life comes out of ...",9780071772204,287,Business & Economics,en,1911.15,1911.15,"crucial conversations tools for talking when stakes are high, second edition",,,
Crushing It,Gary Vaynerchuck,Gramedia Pustaka Utama,2020-11-19,"Di Crushing It!, Gary menjelaskan mengapa kini hal itu semakin penting dan menawarkan perspektif uniknya tentang apa yang berubah dan yang abadi.",9786020645315,368,Self-Help,id,581.29,290.64,crushing it,₹199.00,₹550.00,2.0
Crying in H Mart,Michelle Zauner,Pan Macmillan,2021-05-13,". . It’s fantastic&#39; – Olivia Rodrigo In this story of family and food, grief and joy, Michelle Zauner proves herself far more than a dazzling singer, songwriter and guitarist.",9781529033809,256,Biography & Autobiography,en,560.78,280.39,crying in h mart,₹210.00,₹599.00,4.0
Daily Habbit Makeover,Zoe McKey,Jaico Publishing House,2023-07-20,"... <b>habits</b> and decide to break the <b>habit</b>. Commit to this goal. b. Step number two is to have at least one actual goal (apart from breaking procrastination). Something in deep alignment with your values, something you long for. (You know&nbsp;...",9788119153268,120,Self-Help,en,352.82,246.97,daily habbit makeover,,,
Daughter of the East: An Autobiography,Benazir Bhutto,Simon and Schuster,2014-06-05,"Beautiful and charismatic, the daughter of one of Pakistan&#39;s most popular leaders -- Zulfikar Ali Bhutto, hanged by General Zia in 1979 -- Benazir Bhutto is not only the first woman to lead a post-colonial Muslim state, she achieved a ...",9781471138133,692,Biography & Autobiography,en,529.82,264.91,daughter of the east: an autobiography,,,
"Dear Stranger, I Know How You Feel",Ashish Bagrecha,Harper Collins,2022-10-03,"Dear Stranger, I don&#39;t know much about you, but I do know how you feel.",9789356293410,141,Self-Help,en,239.0,167.3,"dear stranger, i know how you feel",,,
Storytelling in Design,Anna Dahlström,"""O'Reilly Media, Inc.""",2019-12-12,This practical guide shows you how storytelling can make a powerful difference in product design. Author Anna Dahlström details the many ways you can use storytelling in your projects and throughout your organization.,9781491959374,362,Computers,en,1923.4,1923.4,storytelling in design,,,
Destiny of Souls,Michael Newton,Llewellyn Worldwide,2010-09-08,"&quot;Journey of Souls and Destiny of Souls are two of the most fascinating books I have ever read.&quot;—Academy Award-Winning Actress and Author Shirley MacLaine A pioneer in uncovering the secrets of life, internationally recognized spiritual ...",9780738715988,436,"Body, Mind & Spirit",en,2099.0,2099.0,destiny of souls,,,
Die Empty,Todd Henry,Penguin,2013-09-26,"Each day that you postpone the hard work and succumb to the clutter that chokes creativity, discipline, and innovation will result in a net deficit to the world, to your company, and to yourself.",9781101600627,202,Business & Economics,en,679.66,339.83,die empty,,,
Digital Minimalism,Cal Newport,Penguin UK,2019-02-05,"Are you feeling frazzled after a long day of endless video calls? In this timely book, professor Cal Newport shows us how to pair back digital distractions and live a more meaningful life with less technology.",9780241341155,163,Self-Help,en,530.11,265.06,digital minimalism,,,
Discipline Is Destiny,Ryan Holiday,Profile Books,2022-09-27,"In this second volume of the bestselling Stoic Virtues series, Ryan Holiday shows how the most important battle is always with the self. What can you do? Who will you be? Discipline is destiny. Do you have it?",9781782837589,329,Self-Help,en,1029.19,514.6,discipline is destiny,₹199.00,₹499.00,4.0
Loser Kahin Ka,Pankaj Dubey,Penguin UK,2013-12-01,"Note: This book is in the Hindi language and has been made available for the Kindle, Kindle Fire HD, Kindle Paperwhite, iPhone and iPad, and for iOS, Windows Phone and Android devices.",9789351186854,219,Fiction,hi,147.5,147.5,loser kahin ka,,,
Do-It-Yourself Home Energy Audits,David Findley,McGraw Hill Professional,2010-03-08,"... <b>Today</b>. at. No. Cost. to. You. You have purchased, borrowed, or stolen this book so that you could im- prove your home, save money, and therefore live better and more com- fortably. That is a good first step. Let&#39;s begin now with some things&nbsp;...",9780071636407,241,Technology & Engineering,en,2293.56,2293.56,do-it-yourself home energy audits,,,
Do the Hard Things First: Breaking Bad Habits,Scott Allan,"Scott Allan Publishing, LLC",2023-10-08,"... <b>Hard Things First</b> Mindset in Cultivating Self-Discipline The Do the <b>Hard Things First</b> mindset is critical to maintaining discipline, so you must cultivate it. By consciously tackling the most <b>difficult</b> tasks or habits early on, we tap&nbsp;...",9781990484919,174,Psychology,en,649.0,325.0,do the hard things first: breaking bad habits,,,
How to Do Everything: Digital Camera,Dave Johnson,McGraw Hill Professional,2008-03-05,"... <b>work</b> . Use of this <b>work</b> is subject to these terms . Except as permitted under the Copyright Act of 1976 and the right to store and retrieve one copy of the <b>work</b> , you may not decompile , disassemble , reverse engineer , reproduce&nbsp;...",9780071595568,450,Computers,en,2388.94,2388.94,how to do everything: digital camera,,,
"Dopamine Detox: Biohacking Your Way To Better Focus, Greater Happiness, and Peak Performance",Nick Trenton,Amaryllis - an Imprint of Manjul Publishing House,2025-03-05,"Easy yet effective strategies to be present, mindful, and in the moment. Nick Trenton grew up in rural Illinois and is quite literally a farm boy. His best friend growing up was his trusty companion Leonard the dachshund. RIP Leonard.",9789355437440,106,Self-Help,en,260.19,182.13,"dopamine detox: biohacking your way to better focus, greater happiness, and peak performance",,,
DOPAMINE DETOX GUIDE,Castro Atkin,BookRix,2023-03-03,"If so, it may be time for a dopamine detox. In this comprehensive guide, you&#39;ll learn everything you need to know about dopamine detox, a powerful tool for reducing stress, improving focus, and creating a healthier balance in your life.",9783755434221,48,Health & Fitness,en,271.49,190.04,dopamine detox guide,,,
The Official Dopamine Nation Workbook,Anna Lembke,Hachette UK,2024-10-01,"Now, she&#39;s written the workbook that we&#39;ve all been waiting for. Full of specific exercises, fill-in tables, and inspiring examples, readers will be able to more clearly identify the substances and behaviors they struggle to moderate.",9781035416561,167,Social Science,en,560.5,280.25,the official dopamine nation workbook,,,
Summary: DotCom Secrets,"BusinessNews Publishing,",Business Book Summaries,2016-07-20,"This is what will drive traffic to your website and then push them through to make a purchase. The funnel is made up of various different strategies; a traffic strategy, a product strategy and a communication strategy.",9782511040942,27,Business & Economics,en,1055.71,527.86,summary: dotcom secrets,,,
The Illustrated Easy Way to Stop Smoking,Allen Carr,Arcturus Publishing,2007-05-15,What people say about Allen Carr&#39;s Easyway method: &quot;I stopped smoking... I read this book by Allen Carr. It&#39;s called the Easy Way to Stop Smoking. Everyone who reads this book stops smoking!,9781848586574,137,Self-Help,en,200.0,140.0,the illustrated easy way to stop smoking,,,
Eat That Frog (Marathi),Brian Tracy,Manjul Publishing,2019,या पुस्तकातून वेळेचं प्रभावी नियोजन कसं करायचं आणि त्याच्या आधारे दररोज आपल्या पुढ्यातील ...,9789388241373,127,Fiction,mr,141.6,141.6,eat that frog (marathi),,,
Eat That Frog (Marathi),Brian Tracy,Manjul Publishing,2019,या पुस्तकातून वेळेचं प्रभावी नियोजन कसं करायचं आणि त्याच्या आधारे दररोज आपल्या पुढ्यातील ...,9789388241373,127,Fiction,mr,141.6,141.6,eat that frog (marathi),,,
Eden,Devdutt Pattanaik,Penguin Random House India Private Limited,2021-12-20,"An <b>Indian</b> Retelling of <b>Jewish</b>, <b>Christian and Islamic Lore</b> Devdutt Pattanaik. BY THE SAME AUTHOR Myth=Mithya: Decoding Hindu Mythology The Book of Ram The Pregnant King Jaya: An ... <b>INDIAN EXPLORATION OF JEWISH</b> , <b>CHRISTIAN AND ISLAMIC</b>.",9789354924057,351,Religion,en,538.08,269.04,eden,,,
The Effortless Experience,"Matthew Dixon, Nicholas Toman, Rick DeLisi",Penguin UK,2013-09-12,"Here are tools and templates you can start applying right away to improve service, reduce costs, and ultimately generate the elusive loyalty that the &#39;dazzle factor&#39; fails to deliver.",9780241967928,219,Business & Economics,en,707.11,353.56,the effortless experience,,,
Breakthrough Strategies for Predicting Any Market,Jeff Greenblatt,John Wiley & Sons,2013-09-30,"The revised and updated edition of the book that changed the way you think about trading In the Second Edition of this groundbreaking book by star trader Jeff Greenblatt, he continues to shares his hard-won lessons on what it takes to be a ...",9781118716014,437,Business & Economics,en,13468.52,13468.52,breakthrough strategies for predicting any market,,,
Summary of Elon Musk By Walter Isaacson,GP SUMMARY,BookRix,2023-09-15,DISCLAIMER This book does not in any capacity mean to replace the original book but to serve as a vast summary of the original book.,9783755453307,85,Study Aids,en,509.49,254.74,summary of elon musk,,,
The Curious Mind of Elon Musk,Charles Steel,Greenleaf Book Group,2026-02-24,"... <b>book</b> was born. The existing scholarship on <b>Musk</b> has been of great assistance to me as I went about my research. In ... <b>Walter Isaacson</b> We live in an age of podcasts, and these too have been a tremendous resource. In particular, the&nbsp;...",9798886454321,297,Biography & Autobiography,en,425.0,299.0,the curious mind of elon musk,,,
What is an Emotion?,Dr. William James,Simon and Schuster,2013-03-25,I should say first of all that the only emotions I propose expressly to consider here are those that have a distinct bodily expression.,9781625588883,31,Philosophy,en,66.08,66.08,what is an emotion?,,,
Energize Your Mind,Gaur Gopal Das,Penguin Random House India Private Limited,2023-01-01,"Take charge of your mind. Be in charge of your life. In this book, bestselling author and life coach Gaur Gopal Das decodes how the mind works.",9789354928758,286,Self-Help,en,269.04,188.33,energize your mind,₹149.00,₹299.00,2.0
Energize Your Mind,Gaur Gopal Das,Penguin Random House India Private Limited,2023-01-01,"Take charge of your mind. Be in charge of your life. In this book, bestselling author and life coach Gaur Gopal Das decodes how the mind works.",9789354928758,286,Self-Help,en,269.04,188.33,energize your mind,₹149.00,₹299.00,2.0
Ethics for Behavior Analysts,"Jon S. Bailey, Mary R. Burch",Routledge,2022-04-04,"... <b>4th edition</b> of Ethics for <b>Behavior Analysts</b> is a must read for all <b>behavior analysts</b>. Professors, students, and practitioners have relied on Drs. Bailey and Burch as well ... <b>Behavior Analysts Fourth Edition</b> Jon S. Bailey and.",9781000559156,272,Psychology,en,6690.6,6690.6,ethics for behavior analysts,,,
The Everything Psychology Book,Kendra Cherry,Simon and Schuster,2010-10-18,"This book unravels even the most arcane mysteries of psychology, including: The human drive for food, sex, and other desires What happens when thinking and emotions go awry Why we fall in love with one person and not another How we can ...",9781440506925,304,Psychology,en,201.78,141.25,the everything psychology book,,,
You Are the Placebo,Dr. Joe Dispenza,"Hay House, Inc",2014-04-29,"I love this book.” — Gregg Braden, New York Times best-selling author of The Divine Matrix Chapters Include: Part I. Is It Possible?",9781401944865,393,"Body, Mind & Spirit",en,1222.48,611.24,you are the placebo,,,
The Path of Execution,Rohit Verma,Rohit Verma,2025-05-09,"... <b>Discipline</b> is the Key to <b>Getting Things Done Discipline</b> is the cornerstone of productivity and success. It&#39;s what keeps you focused, motivated, and consistent even when the initial excitement fades. By building <b>discipline</b>, you can&nbsp;...",9781067081935,93,Self-Help,en,1500.0,1500.0,the path of execution,,,
Expectations Investing,"Alfred Rappaport, Michael J. Mauboussin",Harvard Business Review Press,2003-02-18,"Managers will be able to use the book to devise, adjust, and communicate their company&#39;s strategy in light of shareholder expectations.",9781633691520,248,Business & Economics,en,2048.0,2048.0,expectations investing,,,
F-rated,Nandita Dutta,Harper Collins,2019-07-25,A celebration of their womanhood as much as their work - this is a must-read.,9789353029524,221,Performing Arts,en,399.0,279.3,f-rated,,,
Factfulness,"Hans Rosling, Ola Rosling, Anna Rosling Rönnlund",Hachette UK,2018-04-03,OVER A MILLION COPIES SOLD &#39;A hopeful book about the potential for human progress when we work off facts rather than our inherent biases&#39; BARACK OBAMA &#39;One of the most important books I&#39;ve ever read - an indispensable guide to thinking ...,9781473637481,319,Business & Economics,en,401.2,280.84,factfulness,₹199.00,₹499.00,5.0
False Dawn,John Gray,Granta Books,2015-07-02,"The <b>Delusions</b> Of <b>Global Capitalism</b> John Gray. result, the breakdown of the model of capitalism which the US incessantly urged on other countries, and even on occasion applied itself, looks set to reshape the global order in deep and&nbsp;...",9781783782598,226,Business & Economics,en,1134.0,567.0,false dawn,,,
Family Wisdom (Marathi),Robin Sharma,Jaico Publishing House,2015-05-02,"Now In Marathi In the pages of this remarkable book, acclaimed author of the worldwide publishing sensation The Monk Who Sold His Ferrari and internationally renowned leadership guru Robin Sharma reveals a simple yet strikingly effective ...",9788184951912,373,Self-Help,mr,234.82,164.37,family wisdom (marathi),,,
Fast Like a Girl,Dr. Mindy Pelz,"Hay House, Inc",2022-12-27,"Inspired by the thousands of women she has worked with who have reclaimed their health with fasting, Dr. Mindy wrote this book because, “once a woman knows how to build a fasting lifestyle around her cycle, she becomes unstoppable.”",9781401969936,353,Health & Fitness,en,1287.38,643.69,fast like a girl,₹199.00,₹899.00,2.0
Feel-Good Productivity,Ali Abdaal,Random House,2023-12-28,". . If you are stuck in a job you hate, or are finding it hard to get up enthusiasm for tasks, then Feel-Good Productivity might be the book for you.&#39; Financial Times",9781529159394,160,Self-Help,en,925.12,462.56,feel-good productivity,,,
"Financial Shenanigans, Fourth Edition: How to Detect Accounting Gimmicks and Fraud in Financial Reports","Howard M. Schilit, Jeremy Perler, Yoni Engelhart",McGraw Hill Professional,2018-03-30,The bestselling classic from the “Sherlock Holmes of Accounting”—updated to reflect key case studies from the past quarter century and the dishonest tactics used to mislead investors.This fourth edition of the bestselling guide shines ...,9781260117271,336,Business & Economics,en,4204.71,4204.71,"financial shenanigans, fourth edition: how to detect accounting gimmicks and fraud in financial reports",,,
Find Your Why,"Simon Sinek, David Mead, Peter Docker",Penguin UK,2017-09-05,"Whether you&#39;ve just started your first job, are leading a team or are CEO of your own company, the exercises in this book will help guide you on a path to long-term success and fulfilment, both for you and your colleagues.",9780241978405,194,Business & Economics,en,884.11,442.06,find your why,,,
Intentional,Chris Bailey,Pan Macmillan,2026-01-01,"But consistently making progress until we’ve reached that goal is the hard part. In Intentional, Chris Bailey presents a new and better way to accomplish your goals.",9781035062225,262,Self-Help,en,785.54,392.77,intentional,,,
Flow Experience,"László Harmat, Frans Ørsted Andersen, Fredrik Ullén, Jon Wright, Gaynor Sadlo",Springer,2016-05-15,"... <b>do</b> autotelic Japanese college students feel, behave, and think in their daily lives? Journal of <b>Happiness</b> ... <b>classic work on how to achieve happiness</b> (Rev. ed.). London: Rider. Csíkszentmihályi, M., &amp; Csíkszentmihályi, I. S.&nbsp;...",9783319286341,395,Psychology,en,14278.0,14278.0,flow experience,,,
"Master Your Dopamine: How to Rewire Your Brain for Focus and Peak Performance | Easy Tips to Detox Your Mind, Improve Your Productivity and Stay Happy",Nick Trenton,Sristhi Publishers & Distributors,2025-06-09,"Backed by behavioural science and practical psychology, this book teaches you: ● What dopamine really does—and why chasing constant highs is sabotaging your happiness; ● How to run powerful 1, 3, and 7-day detoxes to reset your system ...",9789364116763,136,Self-Help,en,295.0,206.5,"master your dopamine: how to rewire your brain for focus and peak performance | easy tips to detox your mind, improve your productivity and stay happy",,,
Focus on What Matters (Hindi) / फ़ोकस ऑन व्हाट मैटर्स,Darius Foroux/डेरियस फ़रु,Penguin Random House India Private Limited,2024-09-23,इस शोर-शराबे और अफ़रा-तफ़री की दुनिया में अच्छी तरह जीना इतना कठिन क्यों है? हो सकता है आप ...,9789354929977,239,Business & Economics,hi,224.2,156.94,focus on what matters (hindi) / फ़ोकस ऑन व्हाट मैटर्स,,,
Four Screenplays,Syd Field,Delta,2009-09-30,"This is how an action film is written. Ted Tally adapted Thomas Harris&#39;s chilling 350-page novel, The Silence of the Lambs, into a riveting 120-page script—a lesson in the art and craft of adapting novels into film.",9780307569523,338,Performing Arts,en,603.64,301.82,four screenplays,₹199.00,₹999.00,2.0
Four Thousand Weeks,Oliver Burkeman,Random House,2021-08-26,"You don&#39;t have to fit everything in... Read this book and wake up to a new way of thinking and living&#39; Emma Gannon &#39;Every sentence is riven with gold&#39; Chris Evans &#39;Comforting, fascinating, engaging, inspiring and useful&#39; Marian Keyes",9781473545557,224,Self-Help,en,618.61,309.3,four thousand weeks,₹210.00,₹599.00,5.0
Free Your Mind: The new world of manipulation and how to resist it,"Laura Dodsworth, Patrick Fagan",HarperCollins UK,2023-07-20,The Instant Sunday Times Bestseller Learn how to recognise and resist the daily attempts to control and manipulate your mind.,9780008600839,215,Psychology,en,2457.32,2457.32,free your mind: the new world of manipulation and how to resist it,,,
"Friends, Lovers and the Big Terrible Thing",Matthew Perry,Hachette UK,2022-11-01,"My friends call me Matty.&#39; So begins the riveting story of acclaimed actor Matthew Perry, taking us along on his journey from childhood ambition to fame to addiction and recovery in the aftermath of a life-threatening health scare.",9781472295958,309,Biography & Autobiography,en,560.5,280.25,"friends, lovers and the big terrible thing",₹299.00,₹699.00,2.0
The Uncanny Reader,Marjorie Sandor,Macmillan + ORM,2015-02-24,"The Uncanny Reader: Stories from the Shadows opens with &quot;The Sand-man,&quot; E.T.A. Hoffmann&#39;s 1817 tale of doppelgangers and automatons—a tale that inspired generations of writers and thinkers to come.",9781466838680,515,Fiction,en,560.5,280.25,the uncanny reader,,,
Fusion Strategy,"Vijay Govindarajan, Venkat Venkatraman",Harvard Business Press,2024-03-12,"In Fusion Strategy, world-renowned innovation guru Vijay Govindarajan and digital strategy expert Venkat Venkatraman offer a first-of-its-kind playbook that will help industrial companies combine what they do best—create physical ...",9781647826260,138,Business & Economics,en,2561.0,2561.0,fusion strategy,,,
Games People Play,Eric Berne,Penguin UK,1973-07-26,"We play games all the time; relationship games; power games with our bosses and competitive games with our friends. In this book, Berne reveals the secret ploys and manoeuvres that rule our lives and how to combat them.",9780141938363,214,Self-Help,en,264.61,185.23,games people play,₹249.00,₹499.00,4.0
Get Out of Your Head,Jennie Allen,WaterBrook,2020-01-28,The visionary behind the million-strong IF:Gathering challenges you to exercise your God-given power to shift negative thinking patterns and take back control of your thoughts and emotions. “A must-have resource for anyone looking to get ...,9781601429667,258,Religion,en,755.02,377.51,get out of your head,,,
Getting Started in Currency Trading,"Michael D. Archer, James Lauren Bickford",John Wiley & Sons,2005-05-20,"... <b>analysis</b> of the markets is only one component of your trading sys- tem . In fact , two other components are more important , in the opinion of the authors : money ... <b>Technical Analysis</b> 109 <b>Into</b> the Future The Technician&#39;s Creed.",9780471738336,209,Business & Economics,en,2133.44,2133.44,getting started in currency trading,,,
Getting Things Done in 30 Minutes,David Allen,"Sourcebooks, Inc.",2013-06-01,"Understand the key ideas of Getting Things Done in a fraction of the time, with tools such as: Concise synopsis, which examines the principles of Getting Things Done In-depth analysis of key concepts from Getting Things Done, such as &quot;Next ...",9781623151867,51,Self-Help,en,447.22,313.05,getting things done in 30 minutes,,,
Getting to Yes,"Roger Fisher, William Ury",Random House,2012-06-07,__________________________ THE WORLD&#39;S BESTSELLING GUIDE TO NEGOTIATION Getting to Yes has been in print for over thirty years.,9781448136094,216,Business & Economics,en,398.25,278.78,getting to yes,₹199.00,₹499.00,1.0
Going Infinite,Michael Lewis,Random House,2023-10-03,"The Rise and Fall of a New Tycoon <b>Michael Lewis</b>. campus . I finished the book in late July , a week after Sam leaked ... <b>hardcover</b> in early October , the same day jurors were selected for Sam&#39;s trial in a federal courthouse in lower&nbsp;...",9781802063523,275,Biography & Autobiography,en,848.42,424.21,going infinite,,,
Good Economics For Hard Times - Hamari Sabse Badi Samsyaon ke Behtar Jawab,"Abhijeet V Banerjee, Esther Duflo",Manjul Publishing,2022-12-30,यह पता लगाना हमारे समय की एक बड़ी चुनौती है कि आज की गंभीर आर्थिक समस्याओं से कैसे निपटा ...,9789391242329,362,Business & Economics,hi,413.0,289.1,good economics for hard times,₹225.00,₹499.00,2.0
"Good Energy: The Surprising Connection Between Glucose, Metabolism and Limitless Health",Dr. Casey Means,HarperCollins UK,2024-05-09,"&#39; Jessie Inchauspe, The Glucose Goddess &#39;A powerful vision for a brighter future – for both people and the planet.&#39; Jay Shetty &#39;A tour de force&#39; Dr Mark Hyman",9780008604264,325,Medical,en,2234.17,2234.17,"good energy: the surprising connection between glucose, metabolism and limitless health",,,
GOOD INSIDE,Becky Kennedy,Bentang Pustaka,2023-10-02,Good Inside akan membantu orang tua beralih dari kebingungan dan perasaan “gagal menjadi orang tua” ke kepercayaan diri dan mampu memimpin keluarga dengan kokoh.,9786231862020,301,Family & Relationships,id,433.2,303.24,good inside,,,
